Date,Source_Type,Text,Source_Link
2025-01-01,Research Paper,Towards a Unified Theory of Voxel AI and Safety. A Novel Approach to Voxel AI using Reinforcement Learning for Robotics. Comparative Analysis of Spatial Intelligence vs Generative Text Models. Spatial Intelligence: A Survey of Methods and Applications in Manufacturing.,https://dl.acm.org//abs/2404.5774
2023-01-01,Research Paper,Towards a Unified Theory of Physics-Informed AI and Data Security. Towards a Unified Theory of Physics-Informed AI and Hallucination. The Role of JEPA in Enhancing Data Security for Digital Twins. Beyond LLMs: Physics-Informed AI and the Future of Spatial Computing.,https://www.sciencedirect.com//abs/2408.3562
2023-01-01,Research Paper,Evaluating the Impact of Latent Space Sim on Compute Cost in Urban Planning. Scalable Physics-Informed AI Architectures for Massive Logistics Environments. Evaluating the Impact of Physics-Informed AI on Data Security in Manufacturing. Comparative Analysis of Latent Space Sim vs Generative Text Models.,https://arxiv.org/list/cs.AI/recent/abs/2403.1805
2023-01-01,Research Paper,Scalable Object Permanence Architectures for Massive Logistics Environments. Evaluating the Impact of World Models on Latency in Automotive. The Role of Physics-Informed AI in Enhancing User Experience for Digital Twins. The Role of Digital Twins in Enhancing Compute Cost for Digital Twins.,https://arxiv.org/list/cs.AI/recent/abs/2404.2658
2025-01-01,Research Paper,Towards a Unified Theory of Spatial Intelligence and Data Security. Comparative Analysis of Spatial Agents vs Generative Text Models. Comparative Analysis of Digital Twins vs Generative Text Models. Evaluating the Impact of World Models on Privacy in Industrial XR.,https://www.sciencedirect.com//abs/2406.6134
2024-01-01,Research Paper,Evaluating the Impact of Latent Space Sim on User Experience in Construction. The Role of Spatial Agents in Enhancing Privacy for Digital Twins. Object Permanence: A Survey of Methods and Applications in Logistics. Scalable Voxel AI Architectures for Massive Robotics Environments.,https://ieeexplore.ieee.org/search/searchresult.jsp?newsearch=true&queryText=%22Spatial%20Computing%22/abs/2404.2478
2025-01-01,Research Paper,Towards a Unified Theory of Spatial Intelligence and Hallucination. A Novel Approach to Spatial Intelligence using Bayesian Inference for Manufacturing. Integrating Spatial Agents with Differential Equations for Real-time Defense Simulation. Towards a Unified Theory of World Models and Ethics.,https://scholar.google.com//abs/2405.5349
2025-01-01,Research Paper,Integrating Neural Physics with Graph Neural Networks for Real-time Energy Simulation. Integrating Spatial Agents with Diffusion Models for Real-time Healthcare Simulation. The Role of Spatial Intelligence in Enhancing Data Security for Digital Twins. Comparative Analysis of Digital Twins vs Generative Text Models.,https://arxiv.org/list/cs.AI/recent/abs/2407.1618
2023-01-01,Research Paper,Scalable Spatial Agents Architectures for Massive Robotics Environments. Digital Twins: A Survey of Methods and Applications in Manufacturing. Beyond LLMs: Voxel AI and the Future of Spatial Computing. A Novel Approach to Digital Twins using Bayesian Inference for Industrial XR.,https://ieeexplore.ieee.org/search/searchresult.jsp?newsearch=true&queryText=%22Spatial%20Computing%22/abs/2409.6296
2024-01-01,Research Paper,Robustness of Physics-Informed AI against Safety vulnerabilities. Scalable Neural Physics Architectures for Massive Automotive Environments. Towards a Unified Theory of Spatial Intelligence and Surveillance. Beyond LLMs: JEPA and the Future of Spatial Computing.,https://www.sciencedirect.com//abs/2402.4416
2023-01-01,Research Paper,Towards a Unified Theory of World Models and Hallucination. A Novel Approach to Spatial Agents using Transformer Networks for Healthcare. A Novel Approach to Digital Twins using Reinforcement Learning for Energy. Evaluating the Impact of Neural Physics on Safety in Healthcare.,https://paperswithcode.com//abs/2404.8571
2024-01-01,Research Paper,Scalable Voxel AI Architectures for Massive Automotive Environments. Comparative Analysis of Spatial Agents vs Generative Text Models. Evaluating the Impact of Spatial Intelligence on Data Security in Logistics. Towards a Unified Theory of Physics-Informed AI and Hallucination.,https://www.sciencedirect.com//abs/2403.3939
2025-01-01,Research Paper,Voxel AI: A Survey of Methods and Applications in Automotive. Scalable Spatial Agents Architectures for Massive Defense Environments. Evaluating the Impact of World Models on User Experience in Healthcare. The Role of Object Permanence in Enhancing Ethics for Digital Twins.,https://www.researchgate.net//abs/2402.5381
2025-01-01,Research Paper,Scalable Physics-Informed AI Architectures for Massive Urban Planning Environments. Beyond LLMs: Spatial Intelligence and the Future of Spatial Computing. Beyond LLMs: Latent Space Sim and the Future of Spatial Computing. Beyond LLMs: Neural Physics and the Future of Spatial Computing.,https://paperswithcode.com//abs/2405.2857
2023-01-01,Research Paper,Robustness of Spatial Intelligence against Accuracy vulnerabilities. Integrating Object Permanence with Differential Equations for Real-time Industrial XR Simulation. Beyond LLMs: Latent Space Sim and the Future of Spatial Computing. Spatial Intelligence: A Survey of Methods and Applications in Automotive.,https://scholar.google.com//abs/2402.8683
2025-01-01,Research Paper,The Role of Latent Space Sim in Enhancing User Experience for Digital Twins. A Novel Approach to Spatial Agents using Gaussian Splatting for Healthcare. Towards a Unified Theory of Latent Space Sim and User Experience. Robustness of Digital Twins against Data Security vulnerabilities.,https://www.sciencedirect.com//abs/2409.6032
2024-01-01,Research Paper,Towards a Unified Theory of Neural Physics and Latency. Beyond LLMs: Physics-Informed AI and the Future of Spatial Computing. Integrating Neural Physics with Reinforcement Learning for Real-time Construction Simulation. Evaluating the Impact of JEPA on Accuracy in Defense.,https://www.researchgate.net//abs/2401.4572
2025-01-01,Research Paper,A Novel Approach to Physics-Informed AI using Reinforcement Learning for Defense. Robustness of Voxel AI against Latency vulnerabilities. Comparative Analysis of Neural Physics vs Generative Text Models. Beyond LLMs: Neural Physics and the Future of Spatial Computing.,https://dl.acm.org//abs/2406.5813
2024-01-01,Research Paper,Towards a Unified Theory of Physics-Informed AI and Accuracy. Evaluating the Impact of JEPA on Ethics in Defense. Towards a Unified Theory of Spatial Intelligence and Compute Cost. Comparative Analysis of World Models vs Generative Text Models.,https://ieeexplore.ieee.org/search/searchresult.jsp?newsearch=true&queryText=%22Spatial%20Computing%22/abs/2403.6926
2024-01-01,Research Paper,Latent Space Sim: A Survey of Methods and Applications in Defense. Evaluating the Impact of Physics-Informed AI on Ethics in Defense. A Novel Approach to Voxel AI using Bayesian Inference for Defense. Towards a Unified Theory of Digital Twins and Privacy.,https://www.sciencedirect.com//abs/2407.8972
2024-01-01,Research Paper,Integrating Spatial Agents with Gaussian Splatting for Real-time Healthcare Simulation. Towards a Unified Theory of Digital Twins and Ethics. Robustness of Physics-Informed AI against Compute Cost vulnerabilities. A Novel Approach to JEPA using Bayesian Inference for Industrial XR.,https://www.sciencedirect.com//abs/2404.7566
2024-01-01,Research Paper,Spatial Intelligence: A Survey of Methods and Applications in Automotive. A Novel Approach to Object Permanence using Bayesian Inference for Industrial XR. Scalable Spatial Intelligence Architectures for Massive Energy Environments. Integrating Spatial Intelligence with Graph Neural Networks for Real-time Energy Simulation.,https://scholar.google.com//abs/2403.3236
2024-01-01,Research Paper,Comparative Analysis of Spatial Agents vs Generative Text Models. Scalable Object Permanence Architectures for Massive Robotics Environments. Towards a Unified Theory of World Models and User Experience. Evaluating the Impact of Spatial Intelligence on Compute Cost in Logistics.,https://www.researchgate.net//abs/2401.5931
2024-01-01,Research Paper,Towards a Unified Theory of Spatial Agents and Hallucination. JEPA: A Survey of Methods and Applications in Automotive. Integrating Voxel AI with Bayesian Inference for Real-time Healthcare Simulation. Robustness of Physics-Informed AI against Safety vulnerabilities.,https://paperswithcode.com//abs/2403.7601
2023-01-01,Research Paper,The Role of Voxel AI in Enhancing Privacy for Digital Twins. Beyond LLMs: Object Permanence and the Future of Spatial Computing. Towards a Unified Theory of JEPA and Accuracy. Scalable Latent Space Sim Architectures for Massive Healthcare Environments.,https://dl.acm.org//abs/2402.9034
2023-01-01,Research Paper,Integrating Spatial Agents with Transformer Networks for Real-time Urban Planning Simulation. Integrating Spatial Agents with Graph Neural Networks for Real-time Manufacturing Simulation. Towards a Unified Theory of Object Permanence and Latency. Neural Physics: A Survey of Methods and Applications in Healthcare.,https://www.sciencedirect.com//abs/2404.5610
2025-01-01,Research Paper,Towards a Unified Theory of Spatial Intelligence and Ethics. Robustness of Latent Space Sim against Privacy vulnerabilities. Integrating JEPA with Gaussian Splatting for Real-time Logistics Simulation. JEPA: A Survey of Methods and Applications in Construction.,https://arxiv.org/list/cs.AI/recent/abs/2402.1913
2023-01-01,Research Paper,Evaluating the Impact of Digital Twins on Compute Cost in Urban Planning. A Novel Approach to Physics-Informed AI using Reinforcement Learning for Robotics. Comparative Analysis of JEPA vs Generative Text Models. JEPA: A Survey of Methods and Applications in Defense.,https://dl.acm.org//abs/2409.2038
2025-01-01,Research Paper,Robustness of World Models against Surveillance vulnerabilities. Beyond LLMs: Voxel AI and the Future of Spatial Computing. Comparative Analysis of Spatial Intelligence vs Generative Text Models. Object Permanence: A Survey of Methods and Applications in Energy.,https://www.sciencedirect.com//abs/2403.1365
2024-01-01,Research Paper,Integrating Spatial Intelligence with Diffusion Models for Real-time Healthcare Simulation. Robustness of Spatial Agents against User Experience vulnerabilities. Comparative Analysis of Neural Physics vs Generative Text Models. Integrating Spatial Agents with Differential Equations for Real-time Defense Simulation.,https://scholar.google.com//abs/2409.8005
2023-01-01,Research Paper,Integrating JEPA with Reinforcement Learning for Real-time Construction Simulation. Comparative Analysis of Object Permanence vs Generative Text Models. Comparative Analysis of World Models vs Generative Text Models. Integrating Object Permanence with Graph Neural Networks for Real-time Energy Simulation.,https://dl.acm.org//abs/2406.3160
2024-01-01,Research Paper,Towards a Unified Theory of World Models and Safety. Beyond LLMs: Spatial Intelligence and the Future of Spatial Computing. Evaluating the Impact of Physics-Informed AI on Latency in Urban Planning. Physics-Informed AI: A Survey of Methods and Applications in Logistics.,https://scholar.google.com//abs/2407.3941
2025-01-01,Research Paper,World Models: A Survey of Methods and Applications in Industrial XR. Integrating Digital Twins with Graph Neural Networks for Real-time Healthcare Simulation. Comparative Analysis of Neural Physics vs Generative Text Models. Robustness of Digital Twins against Surveillance vulnerabilities.,https://dl.acm.org//abs/2407.5985
2024-01-01,Research Paper,Beyond LLMs: JEPA and the Future of Spatial Computing. Evaluating the Impact of World Models on Ethics in Automotive. Robustness of Voxel AI against Surveillance vulnerabilities. Robustness of Spatial Intelligence against Safety vulnerabilities.,https://arxiv.org/list/cs.CV/recent/abs/2405.2714
2025-01-01,Research Paper,JEPA: A Survey of Methods and Applications in Energy. Integrating World Models with Bayesian Inference for Real-time Energy Simulation. Beyond LLMs: Spatial Intelligence and the Future of Spatial Computing. Scalable Spatial Intelligence Architectures for Massive Healthcare Environments.,https://dl.acm.org//abs/2408.7429
2024-01-01,Research Paper,The Role of Spatial Agents in Enhancing Privacy for Digital Twins. Physics-Informed AI: A Survey of Methods and Applications in Industrial XR. Latent Space Sim: A Survey of Methods and Applications in Robotics. Comparative Analysis of Latent Space Sim vs Generative Text Models.,https://www.researchgate.net//abs/2406.7551
2023-01-01,Research Paper,The Role of Voxel AI in Enhancing Compute Cost for Digital Twins. Evaluating the Impact of Voxel AI on User Experience in Construction. Scalable Spatial Agents Architectures for Massive Robotics Environments. Towards a Unified Theory of Voxel AI and Hallucination.,https://arxiv.org/list/cs.AI/recent/abs/2405.5016
2025-01-01,Research Paper,The Role of Physics-Informed AI in Enhancing Safety for Digital Twins. The Role of Spatial Intelligence in Enhancing Safety for Digital Twins. Towards a Unified Theory of Voxel AI and Ethics. Scalable Physics-Informed AI Architectures for Massive Energy Environments.,https://scholar.google.com//abs/2402.6293
2023-01-01,Research Paper,Integrating World Models with Diffusion Models for Real-time Manufacturing Simulation. Evaluating the Impact of Latent Space Sim on Ethics in Defense. Beyond LLMs: JEPA and the Future of Spatial Computing. Robustness of Neural Physics against Hallucination vulnerabilities.,https://arxiv.org/list/cs.CV/recent/abs/2406.2316
2024-01-01,Research Paper,Beyond LLMs: Latent Space Sim and the Future of Spatial Computing. Towards a Unified Theory of Neural Physics and Surveillance. Robustness of Latent Space Sim against Surveillance vulnerabilities. Latent Space Sim: A Survey of Methods and Applications in Logistics.,https://paperswithcode.com//abs/2405.5174
2025-01-01,Research Paper,Robustness of Neural Physics against Data Security vulnerabilities. Scalable Spatial Agents Architectures for Massive Automotive Environments. The Role of Neural Physics in Enhancing Ethics for Digital Twins. Towards a Unified Theory of Spatial Agents and Surveillance.,https://arxiv.org/list/cs.CV/recent/abs/2409.7705
2024-01-01,Research Paper,Voxel AI: A Survey of Methods and Applications in Automotive. The Role of Spatial Agents in Enhancing Safety for Digital Twins. Robustness of JEPA against Accuracy vulnerabilities. Evaluating the Impact of Voxel AI on Latency in Manufacturing.,https://ieeexplore.ieee.org/search/searchresult.jsp?newsearch=true&queryText=%22Spatial%20Computing%22/abs/2407.5674
2023-01-01,Research Paper,Robustness of Digital Twins against Surveillance vulnerabilities. Scalable Latent Space Sim Architectures for Massive Automotive Environments. Comparative Analysis of JEPA vs Generative Text Models. Comparative Analysis of Digital Twins vs Generative Text Models.,https://scholar.google.com//abs/2402.5442
2025-01-01,Research Paper,Evaluating the Impact of Digital Twins on Data Security in Healthcare. Scalable Spatial Intelligence Architectures for Massive Industrial XR Environments. Voxel AI: A Survey of Methods and Applications in Urban Planning. Integrating Digital Twins with Gaussian Splatting for Real-time Urban Planning Simulation.,https://www.researchgate.net//abs/2406.6951
2025-06-10,Social Media,Microsoft is winning the Voxel AI race. ,https://twitter.com/unity/status/225880703193991111
2025-07-19,Social Media,Who is working on Physics-Informed AI? Let's connect! ,https://twitter.com/ylecun/status/429433387656303068
2024-09-09,Social Media,I don't trust JEPA with my data.  #User Experience #Privacy,https://twitter.com/VentureBeat/status/821429550335197168
2024-07-25,Social Media,LLMs are so 2023. It's all about Latent Space Sim now. ,https://twitter.com/MetaRealityLabs/status/357513141679656127
2025-12-28,Social Media,"Finally, an AI that understands physics! Voxel AI ftw. ",https://twitter.com/VentureBeat/status/994211126007115984
2024-09-14,Social Media,Can World Models actually solve Ethics? I'm skeptical. ,https://twitter.com/OpenAI/status/834495206868240562
2024-06-20,Social Media,Investing in Voxel AI is a no-brainer.  #Urban Planning,https://twitter.com/TechCrunch/status/395771396286610031
2024-10-27,Social Media,Who is working on Neural Physics? Let's connect! ,https://twitter.com/VentureBeat/status/106675054408459198
2024-09-02,Social Media,I don't trust Digital Twins with my data.  #Accuracy #Privacy,https://twitter.com/nvidiaai/status/367588844740078932
2024-04-08,Social Media,I don't trust JEPA with my data.  #Data Security #Privacy,https://twitter.com/ylecun/status/189791104023294870
2024-04-14,Social Media,Investing in Spatial Intelligence is a no-brainer.  #Healthcare,https://twitter.com/nvidiaai/status/362615381100633601
2024-03-26,Social Media,OpenAI is winning the Digital Twins race. ,https://twitter.com/unity/status/928007636841221039
2025-01-11,Social Media,Just tried the new Meta headset. Spatial Intelligence is next level. ,https://twitter.com/UnrealEngine/status/829291280909815966
2025-09-06,Social Media,The Latency implications of World Models are terrifying. ,https://twitter.com/ylecun/status/289092597683992986
2024-05-03,Social Media,I don't trust World Models with my data.  #Privacy #Privacy,https://twitter.com/UnrealEngine/status/830976116118932899
2024-01-01,Social Media,Investing in World Models is a no-brainer.  #Healthcare,https://twitter.com/ylecun/status/603159871830823588
2024-08-15,Social Media,LLMs are so 2023. It's all about Physics-Informed AI now. ,https://twitter.com/unity/status/871437283023892022
2024-10-21,Social Media,LLMs are so 2023. It's all about Spatial Agents now. ,https://twitter.com/VentureBeat/status/819391550034115337
2025-05-12,Social Media,Who is working on Digital Twins? Let's connect! ,https://twitter.com/MetaRealityLabs/status/554015079488248288
2024-09-18,Social Media,"Finally, an AI that understands physics! JEPA ftw. ",https://twitter.com/VentureBeat/status/898482067247739561
2025-07-16,Social Media,Can Spatial Agents actually solve User Experience? I'm skeptical. ,https://twitter.com/MetaRealityLabs/status/998682656911803916
2025-12-23,Social Media,Investing in JEPA is a no-brainer.  #Industrial XR,https://twitter.com/OpenAI/status/366139710464158714
2024-04-28,Social Media,Neural Physics is insane!  #Industrial XR #AI,https://twitter.com/TechCrunch/status/572258797173672632
2024-04-04,Social Media,I don't trust Neural Physics with my data.  #Privacy #Privacy,https://twitter.com/TechCrunch/status/936751184842610486
2024-07-04,Social Media,Voxel AI is insane!  #Urban Planning #AI,https://twitter.com/unity/status/644211540288388956
2025-03-24,Social Media,Investing in Spatial Intelligence is a no-brainer.  #Industrial XR,https://twitter.com/unity/status/784667521055321385
2025-06-29,Social Media,Unity is winning the Spatial Intelligence race. ,https://twitter.com/unity/status/588266067383554653
2024-07-02,Social Media,Who is working on JEPA? Let's connect! ,https://twitter.com/ylecun/status/690574048139844309
2025-01-06,Social Media,Spatial Intelligence is insane!  #Construction #AI,https://twitter.com/unity/status/578346882585887699
2025-09-23,Social Media,"Finally, an AI that understands physics! Neural Physics ftw. ",https://twitter.com/UnrealEngine/status/948091296254376949
2025-06-19,Social Media,Investing in World Models is a no-brainer.  #Manufacturing,https://twitter.com/UnrealEngine/status/303446232584150948
2024-02-04,Social Media,Who is working on Physics-Informed AI? Let's connect! ,https://twitter.com/VentureBeat/status/247507547765987149
2024-12-15,Social Media,NVIDIA is winning the Digital Twins race. ,https://twitter.com/ylecun/status/295305122226787151
2024-09-09,Social Media,Latent Space Sim is insane!  #Logistics #AI,https://twitter.com/TechCrunch/status/384683675575462047
2024-04-09,Social Media,Just tried the new Microsoft headset. Object Permanence is next level. ,https://twitter.com/TechCrunch/status/708774840378989679
2024-01-13,Social Media,Digital Twins is insane!  #Energy #AI,https://twitter.com/nvidiaai/status/134981812292019450
2024-01-31,Social Media,I don't trust Neural Physics with my data.  #Safety #Privacy,https://twitter.com/ylecun/status/187478261039949433
2025-06-09,Social Media,Unity is winning the Physics-Informed AI race. ,https://twitter.com/UnrealEngine/status/871085840110263173
2025-01-05,Social Media,I don't trust Spatial Agents with my data.  #Surveillance #Privacy,https://twitter.com/TechCrunch/status/130262738353679243
2024-02-15,Social Media,The Data Security implications of Voxel AI are terrifying. ,https://twitter.com/unity/status/781136478204564489
2025-12-23,Social Media,Who is working on Latent Space Sim? Let's connect! ,https://twitter.com/TechCrunch/status/679273195476857443
2024-08-01,Social Media,LLMs are so 2023. It's all about Spatial Agents now. ,https://twitter.com/OpenAI/status/655525301619016743
2024-10-18,Social Media,Investing in Spatial Intelligence is a no-brainer.  #Industrial XR,https://twitter.com/UnrealEngine/status/394295379448702972
2024-01-25,Social Media,Can JEPA actually solve User Experience? I'm skeptical. ,https://twitter.com/MetaRealityLabs/status/432754791705534155
2024-10-17,Social Media,Investing in Digital Twins is a no-brainer.  #Urban Planning,https://twitter.com/nvidiaai/status/339488456958939539
2025-12-13,Social Media,I don't trust Spatial Agents with my data.  #Ethics #Privacy,https://twitter.com/ylecun/status/100043977131598842
2024-03-02,Social Media,LLMs are so 2023. It's all about World Models now. ,https://twitter.com/unity/status/648200228999008826
2025-09-14,Social Media,Digital Twins is insane!  #Urban Planning #AI,https://twitter.com/unity/status/371950988123298885
2025-09-15,Social Media,I don't trust Spatial Intelligence with my data.  #Latency #Privacy,https://twitter.com/ylecun/status/300058330062652374
2024-04-16,Social Media,Who is working on Digital Twins? Let's connect! ,https://twitter.com/ylecun/status/177340216297595154
2024-09-25,Social Media,Who is working on Latent Space Sim? Let's connect! ,https://twitter.com/UnrealEngine/status/436957712796581039
2024-03-29,Social Media,Digital Twins is insane!  #Healthcare #AI,https://twitter.com/ylecun/status/903299153202159046
2024-04-12,Social Media,Google DeepMind is winning the Spatial Agents race. ,https://twitter.com/ylecun/status/487708421516695956
2025-06-19,Social Media,Can Spatial Agents actually solve Safety? I'm skeptical. ,https://twitter.com/ylecun/status/883485817749793107
2025-04-28,Social Media,Investing in Spatial Agents is a no-brainer.  #Industrial XR,https://twitter.com/MetaRealityLabs/status/440123084065428053
2024-08-28,Social Media,Who is working on Digital Twins? Let's connect! ,https://twitter.com/nvidiaai/status/991113367285541639
2024-06-15,Social Media,Can Latent Space Sim actually solve Surveillance? I'm skeptical. ,https://twitter.com/nvidiaai/status/158422974572658878
2024-02-03,Social Media,"Finally, an AI that understands physics! Spatial Agents ftw. ",https://twitter.com/OpenAI/status/436816997723402908
2025-03-31,Social Media,Just tried the new OpenAI headset. JEPA is next level. ,https://twitter.com/VentureBeat/status/195422831384157445
2025-02-28,Social Media,I don't trust JEPA with my data.  #User Experience #Privacy,https://twitter.com/nvidiaai/status/768770029950411547
2024-03-03,Social Media,Just tried the new OpenAI headset. Digital Twins is next level. ,https://twitter.com/TechCrunch/status/124658932237498831
2024-06-01,Social Media,Who is working on Physics-Informed AI? Let's connect! ,https://twitter.com/UnrealEngine/status/462696658002785239
2025-01-18,Social Media,JEPA is insane!  #Urban Planning #AI,https://twitter.com/VentureBeat/status/112992261979561050
2025-09-30,Social Media,Just tried the new Microsoft headset. JEPA is next level. ,https://twitter.com/UnrealEngine/status/971521322922092213
2025-03-03,Social Media,Spatial Intelligence is insane!  #Construction #AI,https://twitter.com/unity/status/389675382003820501
2024-08-04,Social Media,LLMs are so 2023. It's all about Physics-Informed AI now. ,https://twitter.com/MetaRealityLabs/status/524951744894654941
2025-11-02,Social Media,Investing in Spatial Intelligence is a no-brainer.  #Urban Planning,https://twitter.com/nvidiaai/status/431719678883795563
2024-03-13,Social Media,Can JEPA actually solve Data Security? I'm skeptical. ,https://twitter.com/MetaRealityLabs/status/415048228312763372
2025-01-24,Social Media,Physics-Informed AI is insane!  #Logistics #AI,https://twitter.com/nvidiaai/status/592014766019571974
2024-05-04,Social Media,Investing in JEPA is a no-brainer.  #Manufacturing,https://twitter.com/unity/status/340411903014183756
2024-07-31,Social Media,Just tried the new OpenAI headset. Physics-Informed AI is next level. ,https://twitter.com/OpenAI/status/683797262007710452
2025-06-24,Social Media,"Finally, an AI that understands physics! JEPA ftw. ",https://twitter.com/UnrealEngine/status/535789141840560196
2024-07-16,Social Media,Who is working on Spatial Agents? Let's connect! ,https://twitter.com/nvidiaai/status/225970544991162478
2024-03-22,Social Media,Can Object Permanence actually solve Hallucination? I'm skeptical. ,https://twitter.com/VentureBeat/status/117975836186293442
2024-03-02,Social Media,"Finally, an AI that understands physics! Physics-Informed AI ftw. ",https://twitter.com/UnrealEngine/status/253215645532542360
