Date,Source_Type,Text,Source_Link
2024-10-27,Professional Network,The ROI on Spatial Intelligence for Automotive is undeniable. 40% efficiency gains.,https://www.linkedin.com/groups/37782/
2025-09-18,Professional Network,Excited to speak at the Logistics summit about Physics-Informed AI and Data Security.,https://www.cio.com/
2025-10-14,Professional Network,"Stop treating XR like a chatbot. We need Voxel AI, not text.",https://www.linkedin.com/groups/4052516/
2025-03-21,Professional Network,"Stop treating XR like a chatbot. We need World Models, not text.",https://www.mckinsey.com/capabilities/mckinsey-digital/our-insights
2024-03-01,Professional Network,The future of work is Neural Physics. Are you ready?,https://www.linkedin.com/groups/4052516/
2025-06-13,Professional Network,Is anyone else worried about Data Security with the new Object Permanence tools?,https://www.cio.com/
2025-11-22,Professional Network,"Stop treating XR like a chatbot. We need Spatial Intelligence, not text.",https://www.cio.com/
2024-07-24,Professional Network,Great discussion on Object Permanence vs LLMs today. The consensus is clear: physics matters.,https://www.linkedin.com/groups/4052516/
2024-04-05,Professional Network,We need to talk about Data Security in Digital Twins. It's a ticking time bomb.,https://www.mckinsey.com/capabilities/mckinsey-digital/our-insights
2025-02-16,Professional Network,Excited to speak at the Logistics summit about JEPA and Latency.,https://www.linkedin.com/groups/37782/
2024-01-10,Professional Network,Is anyone else worried about Privacy with the new Object Permanence tools?,https://www.mckinsey.com/capabilities/mckinsey-digital/our-insights
2024-08-28,Professional Network,Hiring for Digital Twin Engineer with experience in JEPA and Robotics.,https://www.linkedin.com/groups/4052516/
2025-07-07,Professional Network,Proud to announce our new partnership with Meta to build World Models solutions.,https://www.gartner.com/en/information-technology
2024-04-23,Professional Network,Just saw a demo of Digital Twins by Meta. Mind blown! #XR #AI,https://www.cio.com/
2024-09-15,Professional Network,"Stop treating XR like a chatbot. We need Latent Space Sim, not text.",https://www.mckinsey.com/capabilities/mckinsey-digital/our-insights
2025-05-01,Professional Network,"Stop treating XR like a chatbot. We need Voxel AI, not text.",https://www.cio.com/
2025-05-15,Professional Network,"Stop treating XR like a chatbot. We need JEPA, not text.",https://www.mckinsey.com/capabilities/mckinsey-digital/our-insights
2025-09-17,Professional Network,Proud to announce our new partnership with NVIDIA to build Spatial Intelligence solutions.,https://www.gartner.com/en/information-technology
2025-06-26,Professional Network,"Stop treating XR like a chatbot. We need Voxel AI, not text.",https://www.mckinsey.com/capabilities/mckinsey-digital/our-insights
2025-10-04,Professional Network,Excited to speak at the Energy summit about Neural Physics and Ethics.,https://www.cio.com/
2025-05-08,Professional Network,Excited to speak at the Healthcare summit about Latent Space Sim and Accuracy.,https://www.linkedin.com/groups/4052516/
2024-06-18,Professional Network,Just saw a demo of Physics-Informed AI by Siemens. Mind blown! #XR #AI,https://www.gartner.com/en/information-technology
2024-07-10,Professional Network,Just saw a demo of Physics-Informed AI by Unity. Mind blown! #XR #AI,https://www.linkedin.com/groups/4052516/
2025-06-08,Professional Network,Is anyone else worried about Latency with the new Spatial Intelligence tools?,https://www.cio.com/
2024-01-14,Professional Network,Proud to announce our new partnership with Apple to build Digital Twins solutions.,https://www.linkedin.com/groups/4052516/
2025-12-10,Professional Network,Great discussion on Spatial Intelligence vs LLMs today. The consensus is clear: physics matters.,https://www.gartner.com/en/information-technology
2025-05-19,Professional Network,"Stop treating XR like a chatbot. We need JEPA, not text.",https://www.gartner.com/en/information-technology
2025-12-07,Professional Network,Hiring for CTO with experience in Object Permanence and Manufacturing.,https://www.mckinsey.com/capabilities/mckinsey-digital/our-insights
2025-08-22,Professional Network,Excited to speak at the Construction summit about Object Permanence and Surveillance.,https://www.linkedin.com/groups/3073331/
2025-08-24,Professional Network,"Stop treating XR like a chatbot. We need Spatial Agents, not text.",https://www.linkedin.com/groups/4052516/
2025-07-02,Professional Network,We need to talk about Hallucination in Physics-Informed AI. It's a ticking time bomb.,https://www.linkedin.com/groups/37782/
2025-10-27,Professional Network,Hiring for AI Researcher with experience in Physics-Informed AI and Logistics.,https://www.linkedin.com/groups/37782/
2024-07-08,Professional Network,Just saw a demo of Digital Twins by Google DeepMind. Mind blown! #XR #AI,https://www.linkedin.com/groups/4052516/
2025-06-09,Professional Network,Great discussion on Spatial Intelligence vs LLMs today. The consensus is clear: physics matters.,https://www.linkedin.com/groups/3073331/
2025-02-16,Professional Network,The ROI on Digital Twins for Logistics is undeniable. 40% efficiency gains.,https://www.linkedin.com/groups/37782/
2025-03-22,Professional Network,"Stop treating XR like a chatbot. We need Neural Physics, not text.",https://www.cio.com/
2025-12-14,Professional Network,Just saw a demo of Object Permanence by Unreal Engine. Mind blown! #XR #AI,https://www.mckinsey.com/capabilities/mckinsey-digital/our-insights
2025-02-12,Professional Network,"Stop treating XR like a chatbot. We need JEPA, not text.",https://www.mckinsey.com/capabilities/mckinsey-digital/our-insights
2024-08-29,Professional Network,Proud to announce our new partnership with Unreal Engine to build Latent Space Sim solutions.,https://www.gartner.com/en/information-technology
2025-10-31,Professional Network,Just saw a demo of JEPA by Tesla. Mind blown! #XR #AI,https://www.linkedin.com/groups/37782/
2025-06-01,Professional Network,Excited to speak at the Urban Planning summit about Neural Physics and Surveillance.,https://www.gartner.com/en/information-technology
2024-12-30,Professional Network,The ROI on World Models for Automotive is undeniable. 40% efficiency gains.,https://www.linkedin.com/groups/37782/
2024-02-22,Professional Network,Hiring for Spatial Computing Architect with experience in Spatial Intelligence and Energy.,https://www.cio.com/
2025-07-17,Professional Network,Excited to speak at the Energy summit about Voxel AI and Safety.,https://www.linkedin.com/groups/4052516/
2024-01-03,Professional Network,Excited to speak at the Industrial XR summit about Voxel AI and Ethics.,https://www.cio.com/
2024-06-18,Professional Network,Hiring for AI Researcher with experience in Spatial Agents and Urban Planning.,https://www.mckinsey.com/capabilities/mckinsey-digital/our-insights
2025-08-15,Professional Network,We need to talk about Hallucination in Latent Space Sim. It's a ticking time bomb.,https://www.linkedin.com/groups/4052516/
2024-05-20,Professional Network,The future of work is JEPA. Are you ready?,https://www.cio.com/
2025-11-15,Professional Network,Great discussion on Latent Space Sim vs LLMs today. The consensus is clear: physics matters.,https://www.mckinsey.com/capabilities/mckinsey-digital/our-insights
2024-07-18,Professional Network,Just saw a demo of World Models by Meta. Mind blown! #XR #AI,https://www.linkedin.com/groups/4052516/
2024-07-14,Professional Network,We need to talk about Compute Cost in Object Permanence. It's a ticking time bomb.,https://www.gartner.com/en/information-technology
2024-08-12,Professional Network,Great discussion on Spatial Agents vs LLMs today. The consensus is clear: physics matters.,https://www.gartner.com/en/information-technology
2024-03-31,Professional Network,Great discussion on Voxel AI vs LLMs today. The consensus is clear: physics matters.,https://www.mckinsey.com/capabilities/mckinsey-digital/our-insights
2025-03-19,Professional Network,"Stop treating XR like a chatbot. We need World Models, not text.",https://www.linkedin.com/groups/3073331/
2024-11-28,Professional Network,The ROI on Spatial Agents for Healthcare is undeniable. 40% efficiency gains.,https://www.gartner.com/en/information-technology
2025-07-16,Professional Network,Just saw a demo of JEPA by Google DeepMind. Mind blown! #XR #AI,https://www.mckinsey.com/capabilities/mckinsey-digital/our-insights
2025-09-24,Professional Network,Hiring for XR Developer with experience in Voxel AI and Construction.,https://www.gartner.com/en/information-technology
2024-07-01,Professional Network,Just saw a demo of Spatial Intelligence by Google DeepMind. Mind blown! #XR #AI,https://www.linkedin.com/groups/3073331/
2024-10-15,Professional Network,The future of work is Object Permanence. Are you ready?,https://www.linkedin.com/groups/4052516/
2025-04-01,Professional Network,Proud to announce our new partnership with Tesla to build World Models solutions.,https://www.cio.com/
2025-03-25,Professional Network,Proud to announce our new partnership with Google DeepMind to build JEPA solutions.,https://www.linkedin.com/groups/4052516/
2024-06-03,Professional Network,Great discussion on JEPA vs LLMs today. The consensus is clear: physics matters.,https://www.gartner.com/en/information-technology
2024-10-20,Professional Network,Excited to speak at the Defense summit about Spatial Agents and Compute Cost.,https://www.linkedin.com/groups/3073331/
2025-03-04,Professional Network,Proud to announce our new partnership with NVIDIA to build Latent Space Sim solutions.,https://www.linkedin.com/groups/4052516/
2024-06-07,Professional Network,"Stop treating XR like a chatbot. We need Spatial Agents, not text.",https://www.mckinsey.com/capabilities/mckinsey-digital/our-insights
2024-12-08,Professional Network,"Stop treating XR like a chatbot. We need Spatial Intelligence, not text.",https://www.linkedin.com/groups/3073331/
2024-01-11,Professional Network,"Stop treating XR like a chatbot. We need Digital Twins, not text.",https://www.gartner.com/en/information-technology
2025-11-29,Professional Network,Hiring for Innovation Lead with experience in Neural Physics and Automotive.,https://www.linkedin.com/groups/37782/
2024-01-06,Professional Network,The future of work is Voxel AI. Are you ready?,https://www.mckinsey.com/capabilities/mckinsey-digital/our-insights
2024-05-29,Professional Network,We need to talk about Data Security in JEPA. It's a ticking time bomb.,https://www.linkedin.com/groups/4052516/
2025-01-18,Professional Network,We need to talk about Safety in Object Permanence. It's a ticking time bomb.,https://www.gartner.com/en/information-technology
2025-08-01,Professional Network,The future of work is Voxel AI. Are you ready?,https://www.linkedin.com/groups/3073331/
2025-05-22,Professional Network,"Stop treating XR like a chatbot. We need Object Permanence, not text.",https://www.cio.com/
2024-08-18,Professional Network,The ROI on Neural Physics for Manufacturing is undeniable. 40% efficiency gains.,https://www.linkedin.com/groups/37782/
2025-07-02,Professional Network,Great discussion on Spatial Intelligence vs LLMs today. The consensus is clear: physics matters.,https://www.linkedin.com/groups/3073331/
2024-06-25,Professional Network,Excited to speak at the Manufacturing summit about Neural Physics and Hallucination.,https://www.gartner.com/en/information-technology
2024-07-10,Professional Network,Proud to announce our new partnership with NVIDIA to build Physics-Informed AI solutions.,https://www.linkedin.com/groups/37782/
2025-03-18,Professional Network,Just saw a demo of JEPA by NVIDIA. Mind blown! #XR #AI,https://www.mckinsey.com/capabilities/mckinsey-digital/our-insights
2025-02-20,Professional Network,The future of work is World Models. Are you ready?,https://www.gartner.com/en/information-technology
2024-02-10,Professional Network,We need to talk about Surveillance in Latent Space Sim. It's a ticking time bomb.,https://www.linkedin.com/groups/4052516/
2025-06-01,Professional Network,Great discussion on Latent Space Sim vs LLMs today. The consensus is clear: physics matters.,https://www.cio.com/
2025-12-12,Professional Network,Hiring for Innovation Lead with experience in JEPA and Healthcare.,https://www.mckinsey.com/capabilities/mckinsey-digital/our-insights
2025-12-22,Professional Network,Excited to speak at the Logistics summit about World Models and Accuracy.,https://www.gartner.com/en/information-technology
2024-10-14,Professional Network,Excited to speak at the Healthcare summit about Spatial Intelligence and User Experience.,https://www.linkedin.com/groups/4052516/
2025-12-26,Professional Network,Great discussion on Voxel AI vs LLMs today. The consensus is clear: physics matters.,https://www.linkedin.com/groups/3073331/
2024-10-29,Professional Network,The ROI on Physics-Informed AI for Automotive is undeniable. 40% efficiency gains.,https://www.linkedin.com/groups/37782/
2024-06-07,Professional Network,Just saw a demo of Latent Space Sim by Meta. Mind blown! #XR #AI,https://www.mckinsey.com/capabilities/mckinsey-digital/our-insights
2025-04-23,Professional Network,Excited to speak at the Logistics summit about Spatial Agents and Privacy.,https://www.linkedin.com/groups/3073331/
2025-01-01,Research Paper,Robustness of World Models against Hallucination vulnerabilities. Integrating Digital Twins with Graph Neural Networks for Real-time Healthcare Simulation. Robustness of Physics-Informed AI against Compute Cost vulnerabilities. Robustness of Spatial Intelligence against Compute Cost vulnerabilities.,https://ieeexplore.ieee.org/search/searchresult.jsp?newsearch=true&queryText=%22Spatial%20Computing%22/abs/2404.6319
2025-01-01,Research Paper,Integrating World Models with Graph Neural Networks for Real-time Defense Simulation. The Role of Latent Space Sim in Enhancing Accuracy for Digital Twins. Comparative Analysis of Spatial Intelligence vs Generative Text Models. The Role of Digital Twins in Enhancing Hallucination for Digital Twins.,https://ieeexplore.ieee.org/search/searchresult.jsp?newsearch=true&queryText=%22Spatial%20Computing%22/abs/2409.6632
2024-01-01,Research Paper,Evaluating the Impact of Object Permanence on User Experience in Robotics. Robustness of Digital Twins against Accuracy vulnerabilities. Integrating Object Permanence with Differential Equations for Real-time Construction Simulation. The Role of Physics-Informed AI in Enhancing Ethics for Digital Twins.,https://arxiv.org/list/cs.AI/recent/abs/2407.4543
2024-01-01,Research Paper,Scalable Latent Space Sim Architectures for Massive Urban Planning Environments. Integrating World Models with Differential Equations for Real-time Manufacturing Simulation. Scalable Neural Physics Architectures for Massive Defense Environments. Beyond LLMs: Object Permanence and the Future of Spatial Computing.,https://www.researchgate.net//abs/2403.6557
2023-01-01,Research Paper,JEPA: A Survey of Methods and Applications in Industrial XR. Beyond LLMs: Spatial Agents and the Future of Spatial Computing. Spatial Agents: A Survey of Methods and Applications in Defense. Towards a Unified Theory of Physics-Informed AI and Data Security.,https://scholar.google.com//abs/2401.1382
2023-01-01,Research Paper,Towards a Unified Theory of World Models and Ethics. Scalable Physics-Informed AI Architectures for Massive Defense Environments. Towards a Unified Theory of Object Permanence and Privacy. Neural Physics: A Survey of Methods and Applications in Industrial XR.,https://scholar.google.com//abs/2404.9315
2024-01-01,Research Paper,Robustness of Object Permanence against Hallucination vulnerabilities. Neural Physics: A Survey of Methods and Applications in Robotics. Beyond LLMs: Physics-Informed AI and the Future of Spatial Computing. Towards a Unified Theory of JEPA and Accuracy.,https://dl.acm.org//abs/2402.1588
2025-01-01,Research Paper,Integrating World Models with Gaussian Splatting for Real-time Healthcare Simulation. Beyond LLMs: Latent Space Sim and the Future of Spatial Computing. The Role of Spatial Agents in Enhancing Data Security for Digital Twins. Robustness of Physics-Informed AI against Surveillance vulnerabilities.,https://dl.acm.org//abs/2406.5647
2024-01-01,Research Paper,Towards a Unified Theory of Object Permanence and Compute Cost. Robustness of Spatial Agents against User Experience vulnerabilities. Scalable Object Permanence Architectures for Massive Healthcare Environments. Towards a Unified Theory of Object Permanence and Compute Cost.,https://ieeexplore.ieee.org/search/searchresult.jsp?newsearch=true&queryText=%22Spatial%20Computing%22/abs/2408.3588
2024-01-01,Research Paper,Comparative Analysis of Voxel AI vs Generative Text Models. Evaluating the Impact of Spatial Agents on Data Security in Industrial XR. Beyond LLMs: Physics-Informed AI and the Future of Spatial Computing. Integrating World Models with Reinforcement Learning for Real-time Urban Planning Simulation.,https://www.sciencedirect.com//abs/2401.3787
2024-01-01,Research Paper,Scalable Digital Twins Architectures for Massive Energy Environments. Robustness of Spatial Intelligence against Compute Cost vulnerabilities. A Novel Approach to Spatial Intelligence using Reinforcement Learning for Energy. Integrating Voxel AI with Reinforcement Learning for Real-time Construction Simulation.,https://www.sciencedirect.com//abs/2404.2821
2024-01-01,Research Paper,Spatial Agents: A Survey of Methods and Applications in Defense. Voxel AI: A Survey of Methods and Applications in Robotics. Comparative Analysis of Spatial Intelligence vs Generative Text Models. Beyond LLMs: JEPA and the Future of Spatial Computing.,https://paperswithcode.com//abs/2408.1850
2024-01-01,Research Paper,The Role of Digital Twins in Enhancing Accuracy for Digital Twins. Towards a Unified Theory of Neural Physics and Ethics. The Role of JEPA in Enhancing Surveillance for Digital Twins. Scalable Spatial Intelligence Architectures for Massive Defense Environments.,https://arxiv.org/list/cs.AI/recent/abs/2408.1056
2025-01-01,Research Paper,Towards a Unified Theory of Digital Twins and Privacy. JEPA: A Survey of Methods and Applications in Healthcare. Scalable Latent Space Sim Architectures for Massive Urban Planning Environments. Voxel AI: A Survey of Methods and Applications in Construction.,https://arxiv.org/list/cs.CV/recent/abs/2406.5379
2023-01-01,Research Paper,Comparative Analysis of Digital Twins vs Generative Text Models. Beyond LLMs: Latent Space Sim and the Future of Spatial Computing. Comparative Analysis of JEPA vs Generative Text Models. Evaluating the Impact of Latent Space Sim on Privacy in Defense.,https://www.sciencedirect.com//abs/2408.4079
2024-01-01,Research Paper,Evaluating the Impact of Spatial Intelligence on Data Security in Automotive. Comparative Analysis of Digital Twins vs Generative Text Models. Evaluating the Impact of Latent Space Sim on Accuracy in Defense. Towards a Unified Theory of Digital Twins and Latency.,https://ieeexplore.ieee.org/search/searchresult.jsp?newsearch=true&queryText=%22Spatial%20Computing%22/abs/2403.9340
2023-01-01,Research Paper,The Role of Neural Physics in Enhancing Compute Cost for Digital Twins. Towards a Unified Theory of Spatial Intelligence and Ethics. Scalable JEPA Architectures for Massive Defense Environments. Robustness of World Models against Ethics vulnerabilities.,https://dl.acm.org//abs/2405.8736
2023-01-01,Research Paper,Towards a Unified Theory of World Models and Ethics. Scalable Latent Space Sim Architectures for Massive Healthcare Environments. Scalable Physics-Informed AI Architectures for Massive Robotics Environments. Beyond LLMs: Digital Twins and the Future of Spatial Computing.,https://paperswithcode.com//abs/2401.9470
2023-01-01,Research Paper,Scalable Latent Space Sim Architectures for Massive Automotive Environments. Integrating World Models with Transformer Networks for Real-time Defense Simulation. Evaluating the Impact of Object Permanence on Compute Cost in Construction. Comparative Analysis of Voxel AI vs Generative Text Models.,https://www.sciencedirect.com//abs/2401.7133
2024-01-01,Research Paper,Robustness of JEPA against Compute Cost vulnerabilities. Beyond LLMs: Voxel AI and the Future of Spatial Computing. Robustness of Voxel AI against Latency vulnerabilities. Scalable Spatial Agents Architectures for Massive Defense Environments.,https://www.sciencedirect.com//abs/2404.4240
2023-01-01,Research Paper,The Role of Digital Twins in Enhancing Data Security for Digital Twins. Integrating Voxel AI with Diffusion Models for Real-time Energy Simulation. Evaluating the Impact of Physics-Informed AI on Hallucination in Urban Planning. Towards a Unified Theory of Latent Space Sim and Latency.,https://arxiv.org/list/cs.CV/recent/abs/2402.5702
2024-01-01,Research Paper,Scalable JEPA Architectures for Massive Energy Environments. Object Permanence: A Survey of Methods and Applications in Robotics. Robustness of Spatial Intelligence against Compute Cost vulnerabilities. Evaluating the Impact of Object Permanence on Surveillance in Robotics.,https://paperswithcode.com//abs/2401.2036
2024-01-01,Research Paper,Integrating Physics-Informed AI with Differential Equations for Real-time Logistics Simulation. Robustness of Physics-Informed AI against Data Security vulnerabilities. Beyond LLMs: Spatial Intelligence and the Future of Spatial Computing. Beyond LLMs: Spatial Agents and the Future of Spatial Computing.,https://www.researchgate.net//abs/2407.7936
2023-01-01,Research Paper,Integrating Neural Physics with Graph Neural Networks for Real-time Manufacturing Simulation. Evaluating the Impact of Voxel AI on Safety in Robotics. Towards a Unified Theory of Object Permanence and Data Security. Robustness of Latent Space Sim against Compute Cost vulnerabilities.,https://dl.acm.org//abs/2402.4478
2024-01-01,Research Paper,The Role of Physics-Informed AI in Enhancing Compute Cost for Digital Twins. Towards a Unified Theory of Neural Physics and Latency. Robustness of Latent Space Sim against Accuracy vulnerabilities. Integrating World Models with Transformer Networks for Real-time Robotics Simulation.,https://arxiv.org/list/cs.AI/recent/abs/2401.4292
2024-01-01,Research Paper,A Novel Approach to JEPA using Graph Neural Networks for Manufacturing. Comparative Analysis of JEPA vs Generative Text Models. Scalable Object Permanence Architectures for Massive Healthcare Environments. Scalable Spatial Intelligence Architectures for Massive Energy Environments.,https://paperswithcode.com//abs/2402.4099
2025-01-01,Research Paper,A Novel Approach to Digital Twins using Bayesian Inference for Urban Planning. Scalable Voxel AI Architectures for Massive Robotics Environments. Beyond LLMs: World Models and the Future of Spatial Computing. Robustness of Digital Twins against Latency vulnerabilities.,https://www.researchgate.net//abs/2403.5410
2025-01-01,Research Paper,A Novel Approach to Digital Twins using Transformer Networks for Automotive. Evaluating the Impact of Digital Twins on Accuracy in Energy. Evaluating the Impact of Neural Physics on Ethics in Automotive. Robustness of Spatial Intelligence against Latency vulnerabilities.,https://arxiv.org/list/cs.AI/recent/abs/2404.6520
2024-01-01,Research Paper,Physics-Informed AI: A Survey of Methods and Applications in Robotics. A Novel Approach to Voxel AI using Graph Neural Networks for Manufacturing. Robustness of Physics-Informed AI against Privacy vulnerabilities. The Role of Digital Twins in Enhancing Data Security for Digital Twins.,https://dl.acm.org//abs/2402.3749
2025-01-01,Research Paper,Comparative Analysis of Object Permanence vs Generative Text Models. The Role of Object Permanence in Enhancing Data Security for Digital Twins. A Novel Approach to Physics-Informed AI using Graph Neural Networks for Construction. Latent Space Sim: A Survey of Methods and Applications in Defense.,https://www.researchgate.net//abs/2404.8060
2025-01-01,Research Paper,Integrating Spatial Intelligence with Differential Equations for Real-time Industrial XR Simulation. Towards a Unified Theory of Latent Space Sim and Hallucination. Comparative Analysis of Physics-Informed AI vs Generative Text Models. Scalable Voxel AI Architectures for Massive Defense Environments.,https://ieeexplore.ieee.org/search/searchresult.jsp?newsearch=true&queryText=%22Spatial%20Computing%22/abs/2406.1967
2024-01-01,Research Paper,Evaluating the Impact of Digital Twins on Safety in Energy. Integrating Voxel AI with Transformer Networks for Real-time Robotics Simulation. Physics-Informed AI: A Survey of Methods and Applications in Construction. Object Permanence: A Survey of Methods and Applications in Industrial XR.,https://www.sciencedirect.com//abs/2404.2888
2025-01-01,Research Paper,The Role of Object Permanence in Enhancing Surveillance for Digital Twins. Evaluating the Impact of Object Permanence on Surveillance in Energy. Comparative Analysis of Neural Physics vs Generative Text Models. Beyond LLMs: Spatial Intelligence and the Future of Spatial Computing.,https://scholar.google.com//abs/2406.7675
2023-01-01,Research Paper,Towards a Unified Theory of Digital Twins and Ethics. Integrating World Models with Bayesian Inference for Real-time Industrial XR Simulation. Robustness of JEPA against Latency vulnerabilities. A Novel Approach to JEPA using Transformer Networks for Manufacturing.,https://dl.acm.org//abs/2408.4515
