Date,Source_Type,Text,Source_Link
2024-05-20,Blog,Unity announces new JEPA platform. How OpenAI is using JEPA to revolutionize Urban Planning. The hidden dangers of World Models in Construction.,https://www.theverge.com/vr-virtual-realityarticle/the-ethics-of-voxel-ai-balancing-hallucination-and
2024-04-21,Blog,Understanding the physics of Voxel AI in Manufacturing. The ethics of Spatial Agents: Balancing Ethics and progress. How Google DeepMind is using Voxel AI to revolutionize Manufacturing.,https://www.roadtovr.com/article/top-5-reasons-to-invest-in-spatial-agents-for-auto
2025-10-12,Blog,"Is Object Permanence safe? A deep dive into Accuracy. The ethics of Neural Physics: Balancing User Experience and progress. Forget LLMs, Neural Physics is what matters for Automotive.",https://www.wired.com/tag/virtual-reality/article/is-voxel-ai-safe?-a-deep-dive-into-data-security
2025-09-20,Blog,Top 5 reasons to invest in Physics-Informed AI for Automotive. Why World Models is the future of Robotics. Top 5 reasons to invest in Neural Physics for Healthcare.,https://www.theverge.com/vr-virtual-realityarticle/the-hidden-dangers-of-jepa-in-manufacturing
2025-12-16,Blog,The shift from Generative Text to Spatial Intelligence explained. Top 5 reasons to invest in Digital Twins for Robotics. How Microsoft is using Spatial Agents to revolutionize Manufacturing.,https://www.uploadvr.com/article/the-shift-from-generative-text-to-physics-informed
2025-04-23,Blog,The shift from Generative Text to Voxel AI explained. Top 5 reasons to invest in Spatial Agents for Manufacturing. Understanding the physics of World Models in Robotics.,https://arstechnica.com/gaming/article/the-hidden-dangers-of-physics-informed-ai-in-energ
2024-04-20,Blog,"Forget LLMs, World Models is what matters for Manufacturing. The ethics of Voxel AI: Balancing Latency and progress. Forget LLMs, Latent Space Sim is what matters for Automotive.",https://www.engadget.com/tag/vr/article/how-unreal-engine-is-using-physics-informed-ai-to-
2025-07-07,Blog,NVIDIA announces new JEPA platform. How Siemens is using Spatial Agents to revolutionize Logistics. Understanding the physics of Neural Physics in Industrial XR.,https://www.theverge.com/vr-virtual-realityarticle/the-hidden-dangers-of-digital-twins-in-industrial-
2025-07-07,Blog,Understanding the physics of JEPA in Healthcare. The shift from Generative Text to Latent Space Sim explained. Top 5 reasons to invest in Neural Physics for Robotics.,https://www.forbes.com/innovation/article/the-ethics-of-world-models-balancing-surveillance-
2025-09-16,Blog,"Forget LLMs, World Models is what matters for Robotics. How Google DeepMind is using Physics-Informed AI to revolutionize Manufacturing. Understanding the physics of Physics-Informed AI in Construction.",https://www.zdnet.com/topic/vr-and-ar/article/the-hidden-dangers-of-jepa-in-industrial-xr
2024-09-19,Blog,"Forget LLMs, Digital Twins is what matters for Defense. Understanding the physics of Spatial Agents in Energy. Forget LLMs, Voxel AI is what matters for Healthcare.",https://techcrunch.com/category/augmented-reality/article/unity-announces-new-world-models-platform
2025-11-25,Blog,"Forget LLMs, Voxel AI is what matters for Urban Planning. Understanding the physics of Digital Twins in Manufacturing. Top 5 reasons to invest in Voxel AI for Defense.",https://www.roadtovr.com/article/the-hidden-dangers-of-spatial-agents-in-defense
2025-05-15,Blog,"Why Spatial Intelligence is the future of Manufacturing. Why World Models is the future of Healthcare. Forget LLMs, Neural Physics is what matters for Energy.",https://www.forbes.com/innovation/article/top-5-reasons-to-invest-in-neural-physics-for-indu
2025-10-15,Blog,Understanding the physics of Digital Twins in Defense. The ethics of Spatial Intelligence: Balancing Privacy and progress. The hidden dangers of Physics-Informed AI in Healthcare.,https://arstechnica.com/gaming/article/the-shift-from-generative-text-to-physics-informed
2024-08-24,Blog,How NVIDIA is using World Models to revolutionize Automotive. Is Spatial Intelligence safe? A deep dive into Ethics. Unity announces new Voxel AI platform.,https://venturebeat.com/category/ar-vr/article/is-voxel-ai-safe?-a-deep-dive-into-data-security
2025-11-09,Blog,Top 5 reasons to invest in Object Permanence for Manufacturing. NVIDIA announces new Latent Space Sim platform. Understanding the physics of World Models in Logistics.,https://www.roadtovr.com/article/the-shift-from-generative-text-to-latent-space-sim
2025-04-01,Blog,"The shift from Generative Text to JEPA explained. Meta announces new Physics-Informed AI platform. Forget LLMs, Object Permanence is what matters for Logistics.",https://www.engadget.com/tag/vr/article/the-shift-from-generative-text-to-voxel-ai-explain
2024-03-23,Blog,How Microsoft is using Object Permanence to revolutionize Energy. Top 5 reasons to invest in Digital Twins for Robotics. Top 5 reasons to invest in Spatial Agents for Industrial XR.,https://venturebeat.com/category/ar-vr/article/apple-announces-new-jepa-platform
2024-04-08,Blog,"Forget LLMs, Object Permanence is what matters for Healthcare. Top 5 reasons to invest in Neural Physics for Logistics. How Microsoft is using Latent Space Sim to revolutionize Defense.",https://www.forbes.com/innovation/article/why-digital-twins-is-the-future-of-robotics
2025-01-08,Blog,"The ethics of Spatial Intelligence: Balancing Latency and progress. Is Object Permanence safe? A deep dive into Surveillance. Forget LLMs, Physics-Informed AI is what matters for Logistics.",https://www.theverge.com/vr-virtual-realityarticle/the-hidden-dangers-of-world-models-in-construction
2024-09-29,Blog,Why Neural Physics is the future of Automotive. OpenAI announces new Object Permanence platform. Microsoft announces new Digital Twins platform.,https://www.zdnet.com/topic/vr-and-ar/article/google-deepmind-announces-new-digital-twins-platfo
2025-01-05,Blog,The shift from Generative Text to Spatial Agents explained. The hidden dangers of Neural Physics in Automotive. Top 5 reasons to invest in Digital Twins for Logistics.,https://venturebeat.com/category/ar-vr/article/understanding-the-physics-of-object-permanence-in-
2024-07-25,Blog,Is Voxel AI safe? A deep dive into User Experience. The ethics of Object Permanence: Balancing User Experience and progress. Is Physics-Informed AI safe? A deep dive into Data Security.,"https://www.engadget.com/tag/vr/article/forget-llms,-voxel-ai-is-what-matters-for-healthca"
2024-08-21,Blog,Understanding the physics of Voxel AI in Energy. OpenAI announces new JEPA platform. Understanding the physics of Spatial Intelligence in Industrial XR.,https://www.theverge.com/vr-virtual-realityarticle/why-physics-informed-ai-is-the-future-of-energy
2025-06-22,Blog,Google DeepMind announces new JEPA platform. How Google DeepMind is using Physics-Informed AI to revolutionize Urban Planning. Why Spatial Intelligence is the future of Energy.,https://venturebeat.com/category/ar-vr/article/is-jepa-safe?-a-deep-dive-into-compute-cost
2024-02-25,Blog,The hidden dangers of JEPA in Robotics. Is Physics-Informed AI safe? A deep dive into Hallucination. Siemens announces new Spatial Agents platform.,https://www.roadtovr.com/article/meta-announces-new-world-models-platform
2024-04-21,Blog,"Meta announces new World Models platform. Forget LLMs, Digital Twins is what matters for Robotics. Why Spatial Intelligence is the future of Logistics.",https://www.theverge.com/vr-virtual-realityarticle/the-ethics-of-object-permanence-balancing-privacy-
2024-01-18,Blog,How Apple is using Voxel AI to revolutionize Urban Planning. Top 5 reasons to invest in World Models for Urban Planning. Is World Models safe? A deep dive into Safety.,https://www.wired.com/tag/virtual-reality/article/understanding-the-physics-of-object-permanence-in-
2025-03-02,Blog,Is Spatial Agents safe? A deep dive into Latency. Is Object Permanence safe? A deep dive into Latency. Is Neural Physics safe? A deep dive into Data Security.,https://www.engadget.com/tag/vr/article/the-shift-from-generative-text-to-voxel-ai-explain
2024-09-09,Blog,"The hidden dangers of Digital Twins in Energy. Why Spatial Intelligence is the future of Industrial XR. Forget LLMs, Spatial Intelligence is what matters for Urban Planning.",https://www.roadtovr.com/article/top-5-reasons-to-invest-in-voxel-ai-for-defense
2024-01-08,Blog,"Forget LLMs, JEPA is what matters for Logistics. How Apple is using Digital Twins to revolutionize Healthcare. Top 5 reasons to invest in Neural Physics for Healthcare.",https://venturebeat.com/category/ar-vr/article/nvidia-announces-new-world-models-platform
2024-01-29,Blog,How NVIDIA is using Physics-Informed AI to revolutionize Construction. Is Physics-Informed AI safe? A deep dive into Latency. The shift from Generative Text to Object Permanence explained.,https://www.forbes.com/innovation/article/understanding-the-physics-of-physics-informed-ai-i
2025-09-01,Blog,The shift from Generative Text to Neural Physics explained. Understanding the physics of Neural Physics in Logistics. Understanding the physics of Neural Physics in Urban Planning.,https://techcrunch.com/category/augmented-reality/article/is-voxel-ai-safe?-a-deep-dive-into-user-experience
2024-09-12,Blog,The shift from Generative Text to JEPA explained. Microsoft announces new Latent Space Sim platform. The shift from Generative Text to JEPA explained.,https://www.wired.com/tag/virtual-reality/article/how-siemens-is-using-spatial-agents-to-revolutioni
2024-05-04,Blog,Is Neural Physics safe? A deep dive into Safety. Is Object Permanence safe? A deep dive into Data Security. Why Physics-Informed AI is the future of Healthcare.,"https://www.engadget.com/tag/vr/article/forget-llms,-physics-informed-ai-is-what-matters-f"
2025-05-15,Blog,How Tesla is using Neural Physics to revolutionize Construction. Is Digital Twins safe? A deep dive into Privacy. OpenAI announces new Neural Physics platform.,https://www.zdnet.com/topic/vr-and-ar/article/the-hidden-dangers-of-spatial-intelligence-in-cons
2025-12-25,Blog,The ethics of JEPA: Balancing Accuracy and progress. Is World Models safe? A deep dive into Safety. Why Neural Physics is the future of Automotive.,https://www.wired.com/tag/virtual-reality/article/unity-announces-new-world-models-platform
2025-10-19,Blog,"Is World Models safe? A deep dive into Data Security. Forget LLMs, JEPA is what matters for Construction. Microsoft announces new JEPA platform.",https://www.zdnet.com/topic/vr-and-ar/article/is-object-permanence-safe?-a-deep-dive-into-latenc
2024-05-10,Blog,The shift from Generative Text to Physics-Informed AI explained. Understanding the physics of Object Permanence in Construction. How Siemens is using Object Permanence to revolutionize Manufacturing.,https://www.forbes.com/innovation/article/the-ethics-of-physics-informed-ai-balancing-survei
2025-09-10,Blog,"Top 5 reasons to invest in Neural Physics for Robotics. How Tesla is using Object Permanence to revolutionize Energy. Forget LLMs, JEPA is what matters for Construction.",https://techcrunch.com/category/augmented-reality/article/understanding-the-physics-of-digital-twins-in-robo
2024-05-16,Blog,Top 5 reasons to invest in Latent Space Sim for Manufacturing. Understanding the physics of Voxel AI in Robotics. Understanding the physics of Physics-Informed AI in Defense.,https://venturebeat.com/category/ar-vr/article/unreal-engine-announces-new-world-models-platform
2024-03-22,Blog,The ethics of Spatial Intelligence: Balancing Latency and progress. The hidden dangers of Object Permanence in Healthcare. Google DeepMind announces new Digital Twins platform.,https://www.theverge.com/vr-virtual-realityarticle/understanding-the-physics-of-spatial-intelligence-
2024-05-14,Blog,Unity announces new JEPA platform. The hidden dangers of Object Permanence in Automotive. Understanding the physics of Voxel AI in Automotive.,https://arstechnica.com/gaming/article/top-5-reasons-to-invest-in-neural-physics-for-defe
2024-07-17,Blog,How Unreal Engine is using World Models to revolutionize Industrial XR. The hidden dangers of Spatial Agents in Industrial XR. Understanding the physics of Voxel AI in Logistics.,https://www.zdnet.com/topic/vr-and-ar/article/is-spatial-intelligence-safe?-a-deep-dive-into-com
2024-04-18,Blog,Why Voxel AI is the future of Energy. The hidden dangers of Object Permanence in Logistics. Unity announces new Digital Twins platform.,https://www.forbes.com/innovation/article/openai-announces-new-neural-physics-platform
2025-02-06,Blog,Top 5 reasons to invest in World Models for Logistics. The shift from Generative Text to Voxel AI explained. The hidden dangers of Physics-Informed AI in Defense.,https://www.engadget.com/tag/vr/article/the-hidden-dangers-of-neural-physics-in-industrial
2025-03-23,Blog,Top 5 reasons to invest in Neural Physics for Defense. The hidden dangers of Physics-Informed AI in Manufacturing. The shift from Generative Text to JEPA explained.,"https://techcrunch.com/category/augmented-reality/article/forget-llms,-spatial-agents-is-what-matters-for-in"
2025-05-16,Blog,"Forget LLMs, Object Permanence is what matters for Energy. Why Spatial Agents is the future of Logistics. Understanding the physics of Voxel AI in Urban Planning.","https://www.theverge.com/vr-virtual-realityarticle/forget-llms,-neural-physics-is-what-matters-for-en"
2024-07-26,Blog,Microsoft announces new Spatial Intelligence platform. The shift from Generative Text to Digital Twins explained. Top 5 reasons to invest in Neural Physics for Manufacturing.,https://www.zdnet.com/topic/vr-and-ar/article/how-openai-is-using-spatial-agents-to-revolutioniz
2025-09-29,Blog,The ethics of World Models: Balancing Compute Cost and progress. How Unreal Engine is using Latent Space Sim to revolutionize Logistics. The hidden dangers of Latent Space Sim in Automotive.,https://www.engadget.com/tag/vr/article/why-voxel-ai-is-the-future-of-industrial-xr
2025-06-23,Blog,"Unreal Engine announces new Spatial Agents platform. Forget LLMs, JEPA is what matters for Robotics. Why Digital Twins is the future of Healthcare.",https://www.uploadvr.com/article/why-neural-physics-is-the-future-of-automotive
2024-08-31,Blog,"Why Object Permanence is the future of Manufacturing. Top 5 reasons to invest in JEPA for Energy. Forget LLMs, Digital Twins is what matters for Construction.",https://www.wired.com/tag/virtual-reality/article/the-shift-from-generative-text-to-spatial-agents-e
2024-08-25,Blog,The ethics of Spatial Intelligence: Balancing Hallucination and progress. The hidden dangers of JEPA in Healthcare. Top 5 reasons to invest in Spatial Intelligence for Manufacturing.,https://arstechnica.com/gaming/article/understanding-the-physics-of-voxel-ai-in-industria
2024-06-01,Blog,"How Unreal Engine is using Latent Space Sim to revolutionize Energy. Understanding the physics of Voxel AI in Defense. Forget LLMs, Digital Twins is what matters for Construction.",https://www.engadget.com/tag/vr/article/the-hidden-dangers-of-neural-physics-in-urban-plan
2025-03-27,Blog,The hidden dangers of Voxel AI in Defense. The ethics of Latent Space Sim: Balancing Hallucination and progress. Why Latent Space Sim is the future of Healthcare.,https://www.wired.com/tag/virtual-reality/article/how-openai-is-using-world-models-to-revolutionize-
2025-01-18,Blog,Understanding the physics of JEPA in Urban Planning. Top 5 reasons to invest in Voxel AI for Urban Planning. Top 5 reasons to invest in Voxel AI for Healthcare.,https://www.uploadvr.com/article/how-openai-is-using-voxel-ai-to-revolutionize-robo
2025-10-31,Blog,"Forget LLMs, Spatial Agents is what matters for Construction. How NVIDIA is using Voxel AI to revolutionize Automotive. The shift from Generative Text to Spatial Intelligence explained.",https://venturebeat.com/category/ar-vr/article/is-jepa-safe?-a-deep-dive-into-privacy
2025-04-11,Blog,The ethics of Latent Space Sim: Balancing User Experience and progress. How Unity is using Spatial Agents to revolutionize Defense. Top 5 reasons to invest in Spatial Intelligence for Logistics.,https://www.engadget.com/tag/vr/article/the-hidden-dangers-of-neural-physics-in-robotics
2024-01-25,Professional Network,Great discussion on Digital Twins vs LLMs today. The consensus is clear: physics matters.,https://www.mckinsey.com/capabilities/mckinsey-digital/our-insights
2025-02-12,Professional Network,Excited to speak at the Energy summit about Neural Physics and Accuracy.,https://www.cio.com/
2025-01-09,Professional Network,Hiring for Digital Twin Engineer with experience in World Models and Automotive.,https://www.linkedin.com/groups/37782/
2024-10-22,Professional Network,Excited to speak at the Healthcare summit about Physics-Informed AI and Latency.,https://www.mckinsey.com/capabilities/mckinsey-digital/our-insights
2025-09-09,Professional Network,We need to talk about Hallucination in Neural Physics. It's a ticking time bomb.,https://www.linkedin.com/groups/3073331/
2025-10-19,Professional Network,Is anyone else worried about Hallucination with the new Spatial Intelligence tools?,https://www.mckinsey.com/capabilities/mckinsey-digital/our-insights
2024-07-13,Professional Network,We need to talk about Surveillance in Latent Space Sim. It's a ticking time bomb.,https://www.linkedin.com/groups/4052516/
2024-05-26,Professional Network,The ROI on Physics-Informed AI for Energy is undeniable. 40% efficiency gains.,https://www.gartner.com/en/information-technology
2025-04-03,Professional Network,Proud to announce our new partnership with Meta to build World Models solutions.,https://www.linkedin.com/groups/4052516/
2025-09-25,Professional Network,Just saw a demo of Spatial Intelligence by NVIDIA. Mind blown! #XR #AI,https://www.linkedin.com/groups/4052516/
2025-01-08,Professional Network,Hiring for Digital Twin Engineer with experience in Digital Twins and Healthcare.,https://www.mckinsey.com/capabilities/mckinsey-digital/our-insights
2024-11-27,Professional Network,Hiring for Digital Twin Engineer with experience in Voxel AI and Logistics.,https://www.gartner.com/en/information-technology
2025-01-09,Professional Network,Great discussion on Object Permanence vs LLMs today. The consensus is clear: physics matters.,https://www.gartner.com/en/information-technology
2024-01-20,Professional Network,The future of work is Voxel AI. Are you ready?,https://www.linkedin.com/groups/37782/
2025-07-03,Professional Network,Just saw a demo of JEPA by Unreal Engine. Mind blown! #XR #AI,https://www.linkedin.com/groups/37782/
2024-08-12,Professional Network,Proud to announce our new partnership with Apple to build Voxel AI solutions.,https://www.mckinsey.com/capabilities/mckinsey-digital/our-insights
2025-06-18,Professional Network,Hiring for Digital Twin Engineer with experience in Physics-Informed AI and Automotive.,https://www.cio.com/
2024-06-20,Professional Network,The ROI on Spatial Agents for Defense is undeniable. 40% efficiency gains.,https://www.linkedin.com/groups/4052516/
2025-04-01,Professional Network,The future of work is World Models. Are you ready?,https://www.linkedin.com/groups/4052516/
2024-09-04,Professional Network,The ROI on Object Permanence for Construction is undeniable. 40% efficiency gains.,https://www.linkedin.com/groups/3073331/
2025-02-10,Professional Network,Great discussion on Spatial Agents vs LLMs today. The consensus is clear: physics matters.,https://www.linkedin.com/groups/3073331/
2025-05-08,Professional Network,"Stop treating XR like a chatbot. We need JEPA, not text.",https://www.cio.com/
2025-10-30,Professional Network,Great discussion on Digital Twins vs LLMs today. The consensus is clear: physics matters.,https://www.mckinsey.com/capabilities/mckinsey-digital/our-insights
2025-05-12,Professional Network,Is anyone else worried about Latency with the new Spatial Agents tools?,https://www.linkedin.com/groups/37782/
2024-08-05,Professional Network,Proud to announce our new partnership with Meta to build JEPA solutions.,https://www.mckinsey.com/capabilities/mckinsey-digital/our-insights
2025-09-05,Professional Network,The future of work is Neural Physics. Are you ready?,https://www.linkedin.com/groups/4052516/
2024-11-23,Professional Network,Proud to announce our new partnership with Unreal Engine to build Latent Space Sim solutions.,https://www.cio.com/
2025-12-29,Professional Network,Great discussion on World Models vs LLMs today. The consensus is clear: physics matters.,https://www.mckinsey.com/capabilities/mckinsey-digital/our-insights
2024-09-08,Professional Network,We need to talk about Ethics in JEPA. It's a ticking time bomb.,https://www.mckinsey.com/capabilities/mckinsey-digital/our-insights
2024-04-26,Professional Network,Great discussion on Object Permanence vs LLMs today. The consensus is clear: physics matters.,https://www.linkedin.com/groups/37782/
2025-10-01,Professional Network,The future of work is JEPA. Are you ready?,https://www.gartner.com/en/information-technology
2025-04-02,Professional Network,Is anyone else worried about Privacy with the new Physics-Informed AI tools?,https://www.linkedin.com/groups/37782/
2025-03-25,Professional Network,We need to talk about Latency in Neural Physics. It's a ticking time bomb.,https://www.cio.com/
2024-03-02,Professional Network,Is anyone else worried about Privacy with the new World Models tools?,https://www.linkedin.com/groups/4052516/
2024-12-07,Professional Network,Is anyone else worried about Hallucination with the new Physics-Informed AI tools?,https://www.linkedin.com/groups/3073331/
2025-09-17,Professional Network,Excited to speak at the Automotive summit about Physics-Informed AI and Hallucination.,https://www.gartner.com/en/information-technology
2025-12-11,Professional Network,Proud to announce our new partnership with Unity to build Physics-Informed AI solutions.,https://www.linkedin.com/groups/3073331/
2024-03-10,Professional Network,Proud to announce our new partnership with Apple to build Object Permanence solutions.,https://www.mckinsey.com/capabilities/mckinsey-digital/our-insights
2024-03-03,Professional Network,We need to talk about Ethics in Spatial Agents. It's a ticking time bomb.,https://www.linkedin.com/groups/3073331/
2025-05-30,Professional Network,The future of work is Voxel AI. Are you ready?,https://www.mckinsey.com/capabilities/mckinsey-digital/our-insights
2025-07-20,Professional Network,Hiring for AI Researcher with experience in Voxel AI and Industrial XR.,https://www.linkedin.com/groups/37782/
2024-07-11,Professional Network,Excited to speak at the Robotics summit about Spatial Agents and Compute Cost.,https://www.gartner.com/en/information-technology
2025-05-21,Professional Network,Excited to speak at the Urban Planning summit about Digital Twins and Privacy.,https://www.gartner.com/en/information-technology
2025-12-20,Professional Network,Great discussion on Spatial Agents vs LLMs today. The consensus is clear: physics matters.,https://www.linkedin.com/groups/4052516/
2025-09-12,Professional Network,"Stop treating XR like a chatbot. We need World Models, not text.",https://www.cio.com/
2024-06-08,Professional Network,Is anyone else worried about Compute Cost with the new Object Permanence tools?,https://www.mckinsey.com/capabilities/mckinsey-digital/our-insights
2024-06-27,Professional Network,Excited to speak at the Energy summit about Voxel AI and Hallucination.,https://www.cio.com/
2024-01-18,Professional Network,Great discussion on Latent Space Sim vs LLMs today. The consensus is clear: physics matters.,https://www.linkedin.com/groups/4052516/
2025-02-02,Professional Network,Great discussion on Object Permanence vs LLMs today. The consensus is clear: physics matters.,https://www.linkedin.com/groups/37782/
2024-03-25,Professional Network,"Stop treating XR like a chatbot. We need Object Permanence, not text.",https://www.linkedin.com/groups/4052516/
2024-08-01,Professional Network,Proud to announce our new partnership with Siemens to build Voxel AI solutions.,https://www.linkedin.com/groups/4052516/
2025-03-09,Professional Network,Excited to speak at the Urban Planning summit about World Models and Surveillance.,https://www.mckinsey.com/capabilities/mckinsey-digital/our-insights
2024-10-14,Professional Network,The ROI on Physics-Informed AI for Urban Planning is undeniable. 40% efficiency gains.,https://www.linkedin.com/groups/37782/
2024-05-11,Professional Network,Is anyone else worried about Surveillance with the new Spatial Agents tools?,https://www.mckinsey.com/capabilities/mckinsey-digital/our-insights
2024-11-04,Professional Network,Proud to announce our new partnership with Tesla to build World Models solutions.,https://www.mckinsey.com/capabilities/mckinsey-digital/our-insights
2024-11-11,Professional Network,The future of work is Object Permanence. Are you ready?,https://www.linkedin.com/groups/37782/
2025-02-24,Professional Network,Is anyone else worried about Compute Cost with the new World Models tools?,https://www.cio.com/
2025-09-09,Professional Network,Great discussion on Voxel AI vs LLMs today. The consensus is clear: physics matters.,https://www.linkedin.com/groups/3073331/
2025-04-11,Professional Network,Great discussion on World Models vs LLMs today. The consensus is clear: physics matters.,https://www.linkedin.com/groups/4052516/
2024-12-09,Professional Network,Just saw a demo of Voxel AI by Apple. Mind blown! #XR #AI,https://www.linkedin.com/groups/4052516/
2025-12-06,Professional Network,Hiring for CTO with experience in Neural Physics and Construction.,https://www.cio.com/
2024-08-08,Professional Network,The future of work is JEPA. Are you ready?,https://www.mckinsey.com/capabilities/mckinsey-digital/our-insights
