Date,Source,Title,Content,URL
2025-12-15,Ars Technica,How Unity is using JEPA to revolutionize Automotive.,Top 5 reasons to invest in Spatial Intelligence for Automotive. The hidden dangers of Digital Twins in Defense. The hidden dangers of JEPA in Energy.,https://www.uploadvr.com/article/the-shift-from-generative-text-to-world-models-exp
2025-11-04,Wired,How Apple is using Spatial Agents to revolutionize Logistics.,The hidden dangers of Object Permanence in Industrial XR. How Apple is using JEPA to revolutionize Energy. Why JEPA is the future of Urban Planning.,https://www.theverge.com/vr-virtual-realityarticle/the-shift-from-generative-text-to-world-models-exp
2025-05-16,Ars Technica,The ethics of JEPA: Balancing Privacy and progress.,How Unity is using Neural Physics to revolutionize Robotics. Why JEPA is the future of Urban Planning. Top 5 reasons to invest in JEPA for Robotics.,https://www.uploadvr.com/article/the-hidden-dangers-of-spatial-agents-in-defense
2024-09-02,The Verge,Top 5 reasons to invest in Object Permanence for Industrial XR.,The ethics of Physics-Informed AI: Balancing Hallucination and progress. Understanding the physics of Voxel AI in Construction. How OpenAI is using Spatial Agents to revolutionize Robotics.,https://www.theverge.com/vr-virtual-realityarticle/meta-announces-new-object-permanence-platform
2025-04-07,The Verge,How Siemens is using Object Permanence to revolutionize Construction.,"Forget LLMs, JEPA is what matters for Manufacturing. Why World Models is the future of Urban Planning. How OpenAI is using Neural Physics to revolutionize Manufacturing.",https://www.theverge.com/vr-virtual-realityarticle/why-spatial-intelligence-is-the-future-of-construc
2024-07-04,TechCrunch,Apple announces new World Models platform.,"Why Digital Twins is the future of Industrial XR. The shift from Generative Text to Physics-Informed AI explained. Forget LLMs, Latent Space Sim is what matters for Construction.","https://arstechnica.com/gaming/article/forget-llms,-world-models-is-what-matters-for-heal"
2025-12-11,The Verge,Understanding the physics of JEPA in Urban Planning.,Top 5 reasons to invest in Physics-Informed AI for Industrial XR. The hidden dangers of Voxel AI in Logistics. How NVIDIA is using World Models to revolutionize Healthcare.,https://www.wired.com/tag/virtual-reality/article/is-latent-space-sim-safe?-a-deep-dive-into-safety
2025-12-24,The Verge,Is Latent Space Sim safe? A deep dive into Accuracy.,The ethics of Neural Physics: Balancing Data Security and progress. Top 5 reasons to invest in Neural Physics for Robotics. Why Voxel AI is the future of Manufacturing.,https://arstechnica.com/gaming/article/why-jepa-is-the-future-of-urban-planning
2024-07-13,Wired,The shift from Generative Text to World Models explained.,The hidden dangers of Spatial Intelligence in Automotive. The shift from Generative Text to Object Permanence explained. How Tesla is using Voxel AI to revolutionize Industrial XR.,https://www.uploadvr.com/article/top-5-reasons-to-invest-in-latent-space-sim-for-co
2024-09-01,VentureBeat,The shift from Generative Text to Object Permanence explained.,How Google DeepMind is using World Models to revolutionize Energy. Why JEPA is the future of Industrial XR. The ethics of Spatial Agents: Balancing Surveillance and progress.,https://www.engadget.com/tag/vr/article/the-ethics-of-spatial-agents-balancing-data-securi
2025-12-07,Wired,The ethics of Digital Twins: Balancing Safety and progress.,"Forget LLMs, Voxel AI is what matters for Logistics. The hidden dangers of Object Permanence in Energy. NVIDIA announces new Digital Twins platform.",https://www.roadtovr.com/article/the-ethics-of-world-models-balancing-hallucination
2024-03-08,TechCrunch,The ethics of JEPA: Balancing Accuracy and progress.,How Microsoft is using Latent Space Sim to revolutionize Automotive. Is Latent Space Sim safe? A deep dive into Compute Cost. Is Latent Space Sim safe? A deep dive into Privacy.,https://www.wired.com/tag/virtual-reality/article/how-nvidia-is-using-physics-informed-ai-to-revolut
2025-08-05,TechCrunch,NVIDIA announces new Physics-Informed AI platform.,"Understanding the physics of Physics-Informed AI in Construction. How Unity is using JEPA to revolutionize Urban Planning. Forget LLMs, Physics-Informed AI is what matters for Construction.",https://www.uploadvr.com/article/the-hidden-dangers-of-latent-space-sim-in-energy
2025-08-29,The Verge,"Forget LLMs, Spatial Intelligence is what matters for Energy.",How Meta is using Object Permanence to revolutionize Automotive. The hidden dangers of World Models in Automotive. Why Object Permanence is the future of Industrial XR.,"https://www.engadget.com/tag/vr/article/forget-llms,-voxel-ai-is-what-matters-for-urban-pl"
2025-01-18,VentureBeat,Top 5 reasons to invest in JEPA for Logistics.,Microsoft announces new Spatial Agents platform. Why Latent Space Sim is the future of Defense. The hidden dangers of World Models in Urban Planning.,https://www.theverge.com/vr-virtual-realityarticle/top-5-reasons-to-invest-in-spatial-agents-for-auto
2024-08-28,Ars Technica,How Microsoft is using Digital Twins to revolutionize Urban Planning.,The shift from Generative Text to Voxel AI explained. Is Spatial Agents safe? A deep dive into Ethics. Understanding the physics of World Models in Industrial XR.,https://www.wired.com/tag/virtual-reality/article/understanding-the-physics-of-latent-space-sim-in-r
2024-03-16,VentureBeat,"Forget LLMs, World Models is what matters for Logistics.",Top 5 reasons to invest in Voxel AI for Automotive. How Google DeepMind is using Physics-Informed AI to revolutionize Energy. Is Object Permanence safe? A deep dive into Safety.,https://www.zdnet.com/topic/vr-and-ar/article/understanding-the-physics-of-spatial-intelligence-
2024-05-20,TechCrunch,Why Latent Space Sim is the future of Healthcare.,Unity announces new JEPA platform. How OpenAI is using JEPA to revolutionize Urban Planning. The hidden dangers of World Models in Construction.,https://www.theverge.com/vr-virtual-realityarticle/the-ethics-of-voxel-ai-balancing-hallucination-and
2024-04-21,Ars Technica,"Forget LLMs, Physics-Informed AI is what matters for Construction.",Understanding the physics of Voxel AI in Manufacturing. The ethics of Spatial Agents: Balancing Ethics and progress. How Google DeepMind is using Voxel AI to revolutionize Manufacturing.,https://www.roadtovr.com/article/top-5-reasons-to-invest-in-spatial-agents-for-auto
2025-10-12,VentureBeat,"Forget LLMs, Voxel AI is what matters for Energy.","Is Object Permanence safe? A deep dive into Accuracy. The ethics of Neural Physics: Balancing User Experience and progress. Forget LLMs, Neural Physics is what matters for Automotive.",https://www.wired.com/tag/virtual-reality/article/is-voxel-ai-safe?-a-deep-dive-into-data-security
2025-09-20,Wired,Is Physics-Informed AI safe? A deep dive into Privacy.,Top 5 reasons to invest in Physics-Informed AI for Automotive. Why World Models is the future of Robotics. Top 5 reasons to invest in Neural Physics for Healthcare.,https://www.theverge.com/vr-virtual-realityarticle/the-hidden-dangers-of-jepa-in-manufacturing
2025-12-16,The Verge,Top 5 reasons to invest in Physics-Informed AI for Manufacturing.,The shift from Generative Text to Spatial Intelligence explained. Top 5 reasons to invest in Digital Twins for Robotics. How Microsoft is using Spatial Agents to revolutionize Manufacturing.,https://www.uploadvr.com/article/the-shift-from-generative-text-to-physics-informed
2025-04-23,The Verge,How Unity is using Neural Physics to revolutionize Urban Planning.,The shift from Generative Text to Voxel AI explained. Top 5 reasons to invest in Spatial Agents for Manufacturing. Understanding the physics of World Models in Robotics.,https://arstechnica.com/gaming/article/the-hidden-dangers-of-physics-informed-ai-in-energ
2024-04-20,Wired,Top 5 reasons to invest in Neural Physics for Urban Planning.,"Forget LLMs, World Models is what matters for Manufacturing. The ethics of Voxel AI: Balancing Latency and progress. Forget LLMs, Latent Space Sim is what matters for Automotive.",https://www.engadget.com/tag/vr/article/how-unreal-engine-is-using-physics-informed-ai-to-
2025-07-07,Wired,NVIDIA announces new Spatial Intelligence platform.,NVIDIA announces new JEPA platform. How Siemens is using Spatial Agents to revolutionize Logistics. Understanding the physics of Neural Physics in Industrial XR.,https://www.theverge.com/vr-virtual-realityarticle/the-hidden-dangers-of-digital-twins-in-industrial-
2025-07-07,Wired,The shift from Generative Text to Spatial Intelligence explained.,Understanding the physics of JEPA in Healthcare. The shift from Generative Text to Latent Space Sim explained. Top 5 reasons to invest in Neural Physics for Robotics.,https://www.forbes.com/innovation/article/the-ethics-of-world-models-balancing-surveillance-
2025-09-16,Wired,The shift from Generative Text to Latent Space Sim explained.,"Forget LLMs, World Models is what matters for Robotics. How Google DeepMind is using Physics-Informed AI to revolutionize Manufacturing. Understanding the physics of Physics-Informed AI in Construction.",https://www.zdnet.com/topic/vr-and-ar/article/the-hidden-dangers-of-jepa-in-industrial-xr
2024-09-19,Wired,Top 5 reasons to invest in Neural Physics for Robotics.,"Forget LLMs, Digital Twins is what matters for Defense. Understanding the physics of Spatial Agents in Energy. Forget LLMs, Voxel AI is what matters for Healthcare.",https://techcrunch.com/category/augmented-reality/article/unity-announces-new-world-models-platform
2025-11-25,Ars Technica,The hidden dangers of World Models in Healthcare.,"Forget LLMs, Voxel AI is what matters for Urban Planning. Understanding the physics of Digital Twins in Manufacturing. Top 5 reasons to invest in Voxel AI for Defense.",https://www.roadtovr.com/article/the-hidden-dangers-of-spatial-agents-in-defense
2025-05-15,Wired,The hidden dangers of World Models in Urban Planning.,"Why Spatial Intelligence is the future of Manufacturing. Why World Models is the future of Healthcare. Forget LLMs, Neural Physics is what matters for Energy.",https://www.forbes.com/innovation/article/top-5-reasons-to-invest-in-neural-physics-for-indu
2025-10-15,Wired,The shift from Generative Text to Spatial Agents explained.,Understanding the physics of Digital Twins in Defense. The ethics of Spatial Intelligence: Balancing Privacy and progress. The hidden dangers of Physics-Informed AI in Healthcare.,https://arstechnica.com/gaming/article/the-shift-from-generative-text-to-physics-informed
2024-08-24,TechCrunch,How Tesla is using Spatial Agents to revolutionize Automotive.,How NVIDIA is using World Models to revolutionize Automotive. Is Spatial Intelligence safe? A deep dive into Ethics. Unity announces new Voxel AI platform.,https://venturebeat.com/category/ar-vr/article/is-voxel-ai-safe?-a-deep-dive-into-data-security
2025-11-09,TechCrunch,Is World Models safe? A deep dive into User Experience.,Top 5 reasons to invest in Object Permanence for Manufacturing. NVIDIA announces new Latent Space Sim platform. Understanding the physics of World Models in Logistics.,https://www.roadtovr.com/article/the-shift-from-generative-text-to-latent-space-sim
2025-04-01,Ars Technica,The shift from Generative Text to JEPA explained.,"The shift from Generative Text to JEPA explained. Meta announces new Physics-Informed AI platform. Forget LLMs, Object Permanence is what matters for Logistics.",https://www.engadget.com/tag/vr/article/the-shift-from-generative-text-to-voxel-ai-explain
2024-03-23,TechCrunch,Understanding the physics of Spatial Agents in Automotive.,How Microsoft is using Object Permanence to revolutionize Energy. Top 5 reasons to invest in Digital Twins for Robotics. Top 5 reasons to invest in Spatial Agents for Industrial XR.,https://venturebeat.com/category/ar-vr/article/apple-announces-new-jepa-platform
2024-04-08,Ars Technica,The shift from Generative Text to Physics-Informed AI explained.,"Forget LLMs, Object Permanence is what matters for Healthcare. Top 5 reasons to invest in Neural Physics for Logistics. How Microsoft is using Latent Space Sim to revolutionize Defense.",https://www.forbes.com/innovation/article/why-digital-twins-is-the-future-of-robotics
2025-01-08,TechCrunch,Top 5 reasons to invest in Neural Physics for Manufacturing.,"The ethics of Spatial Intelligence: Balancing Latency and progress. Is Object Permanence safe? A deep dive into Surveillance. Forget LLMs, Physics-Informed AI is what matters for Logistics.",https://www.theverge.com/vr-virtual-realityarticle/the-hidden-dangers-of-world-models-in-construction
2024-09-29,VentureBeat,"Forget LLMs, Object Permanence is what matters for Manufacturing.",Why Neural Physics is the future of Automotive. OpenAI announces new Object Permanence platform. Microsoft announces new Digital Twins platform.,https://www.zdnet.com/topic/vr-and-ar/article/google-deepmind-announces-new-digital-twins-platfo
2025-01-05,Wired,Top 5 reasons to invest in Physics-Informed AI for Construction.,The shift from Generative Text to Spatial Agents explained. The hidden dangers of Neural Physics in Automotive. Top 5 reasons to invest in Digital Twins for Logistics.,https://venturebeat.com/category/ar-vr/article/understanding-the-physics-of-object-permanence-in-
2024-07-25,TechCrunch,Google DeepMind announces new Voxel AI platform.,Is Voxel AI safe? A deep dive into User Experience. The ethics of Object Permanence: Balancing User Experience and progress. Is Physics-Informed AI safe? A deep dive into Data Security.,"https://www.engadget.com/tag/vr/article/forget-llms,-voxel-ai-is-what-matters-for-healthca"
2024-08-21,Wired,Is JEPA safe? A deep dive into Privacy.,Understanding the physics of Voxel AI in Energy. OpenAI announces new JEPA platform. Understanding the physics of Spatial Intelligence in Industrial XR.,https://www.theverge.com/vr-virtual-realityarticle/why-physics-informed-ai-is-the-future-of-energy
2025-06-22,Wired,How Unreal Engine is using Latent Space Sim to revolutionize Urban Planning.,Google DeepMind announces new JEPA platform. How Google DeepMind is using Physics-Informed AI to revolutionize Urban Planning. Why Spatial Intelligence is the future of Energy.,https://venturebeat.com/category/ar-vr/article/is-jepa-safe?-a-deep-dive-into-compute-cost
2024-02-25,The Verge,The hidden dangers of JEPA in Urban Planning.,The hidden dangers of JEPA in Robotics. Is Physics-Informed AI safe? A deep dive into Hallucination. Siemens announces new Spatial Agents platform.,https://www.roadtovr.com/article/meta-announces-new-world-models-platform
2024-04-21,VentureBeat,The hidden dangers of Physics-Informed AI in Construction.,"Meta announces new World Models platform. Forget LLMs, Digital Twins is what matters for Robotics. Why Spatial Intelligence is the future of Logistics.",https://www.theverge.com/vr-virtual-realityarticle/the-ethics-of-object-permanence-balancing-privacy-
2024-01-18,TechCrunch,Understanding the physics of JEPA in Energy.,How Apple is using Voxel AI to revolutionize Urban Planning. Top 5 reasons to invest in World Models for Urban Planning. Is World Models safe? A deep dive into Safety.,https://www.wired.com/tag/virtual-reality/article/understanding-the-physics-of-object-permanence-in-
2025-03-02,Ars Technica,"Forget LLMs, Voxel AI is what matters for Urban Planning.",Is Spatial Agents safe? A deep dive into Latency. Is Object Permanence safe? A deep dive into Latency. Is Neural Physics safe? A deep dive into Data Security.,https://www.engadget.com/tag/vr/article/the-shift-from-generative-text-to-voxel-ai-explain
2024-09-09,VentureBeat,How NVIDIA is using Voxel AI to revolutionize Urban Planning.,"The hidden dangers of Digital Twins in Energy. Why Spatial Intelligence is the future of Industrial XR. Forget LLMs, Spatial Intelligence is what matters for Urban Planning.",https://www.roadtovr.com/article/top-5-reasons-to-invest-in-voxel-ai-for-defense
2024-01-08,VentureBeat,The ethics of Latent Space Sim: Balancing Ethics and progress.,"Forget LLMs, JEPA is what matters for Logistics. How Apple is using Digital Twins to revolutionize Healthcare. Top 5 reasons to invest in Neural Physics for Healthcare.",https://venturebeat.com/category/ar-vr/article/nvidia-announces-new-world-models-platform
2024-01-29,The Verge,Is JEPA safe? A deep dive into User Experience.,How NVIDIA is using Physics-Informed AI to revolutionize Construction. Is Physics-Informed AI safe? A deep dive into Latency. The shift from Generative Text to Object Permanence explained.,https://www.forbes.com/innovation/article/understanding-the-physics-of-physics-informed-ai-i
2025-09-01,TechCrunch,The hidden dangers of Digital Twins in Industrial XR.,The shift from Generative Text to Neural Physics explained. Understanding the physics of Neural Physics in Logistics. Understanding the physics of Neural Physics in Urban Planning.,https://techcrunch.com/category/augmented-reality/article/is-voxel-ai-safe?-a-deep-dive-into-user-experience
2024-09-12,TechCrunch,The shift from Generative Text to World Models explained.,The shift from Generative Text to JEPA explained. Microsoft announces new Latent Space Sim platform. The shift from Generative Text to JEPA explained.,https://www.wired.com/tag/virtual-reality/article/how-siemens-is-using-spatial-agents-to-revolutioni
2024-05-04,Wired,How Meta is using Physics-Informed AI to revolutionize Logistics.,Is Neural Physics safe? A deep dive into Safety. Is Object Permanence safe? A deep dive into Data Security. Why Physics-Informed AI is the future of Healthcare.,"https://www.engadget.com/tag/vr/article/forget-llms,-physics-informed-ai-is-what-matters-f"
2025-05-15,Wired,Understanding the physics of Neural Physics in Robotics.,How Tesla is using Neural Physics to revolutionize Construction. Is Digital Twins safe? A deep dive into Privacy. OpenAI announces new Neural Physics platform.,https://www.zdnet.com/topic/vr-and-ar/article/the-hidden-dangers-of-spatial-intelligence-in-cons
2025-12-25,Ars Technica,"Forget LLMs, Spatial Agents is what matters for Construction.",The ethics of JEPA: Balancing Accuracy and progress. Is World Models safe? A deep dive into Safety. Why Neural Physics is the future of Automotive.,https://www.wired.com/tag/virtual-reality/article/unity-announces-new-world-models-platform
2025-10-19,Wired,Is Voxel AI safe? A deep dive into Ethics.,"Is World Models safe? A deep dive into Data Security. Forget LLMs, JEPA is what matters for Construction. Microsoft announces new JEPA platform.",https://www.zdnet.com/topic/vr-and-ar/article/is-object-permanence-safe?-a-deep-dive-into-latenc
2024-05-10,Ars Technica,OpenAI announces new Object Permanence platform.,The shift from Generative Text to Physics-Informed AI explained. Understanding the physics of Object Permanence in Construction. How Siemens is using Object Permanence to revolutionize Manufacturing.,https://www.forbes.com/innovation/article/the-ethics-of-physics-informed-ai-balancing-survei
2025-09-10,Ars Technica,How Apple is using World Models to revolutionize Logistics.,"Top 5 reasons to invest in Neural Physics for Robotics. How Tesla is using Object Permanence to revolutionize Energy. Forget LLMs, JEPA is what matters for Construction.",https://techcrunch.com/category/augmented-reality/article/understanding-the-physics-of-digital-twins-in-robo
2024-05-16,TechCrunch,How Tesla is using Spatial Agents to revolutionize Defense.,Top 5 reasons to invest in Latent Space Sim for Manufacturing. Understanding the physics of Voxel AI in Robotics. Understanding the physics of Physics-Informed AI in Defense.,https://venturebeat.com/category/ar-vr/article/unreal-engine-announces-new-world-models-platform
2024-03-22,TechCrunch,"Forget LLMs, Neural Physics is what matters for Energy.",The ethics of Spatial Intelligence: Balancing Latency and progress. The hidden dangers of Object Permanence in Healthcare. Google DeepMind announces new Digital Twins platform.,https://www.theverge.com/vr-virtual-realityarticle/understanding-the-physics-of-spatial-intelligence-
2024-05-14,The Verge,Tesla announces new Object Permanence platform.,Unity announces new JEPA platform. The hidden dangers of Object Permanence in Automotive. Understanding the physics of Voxel AI in Automotive.,https://arstechnica.com/gaming/article/top-5-reasons-to-invest-in-neural-physics-for-defe
2024-07-17,Ars Technica,Is World Models safe? A deep dive into Safety.,How Unreal Engine is using World Models to revolutionize Industrial XR. The hidden dangers of Spatial Agents in Industrial XR. Understanding the physics of Voxel AI in Logistics.,https://www.zdnet.com/topic/vr-and-ar/article/is-spatial-intelligence-safe?-a-deep-dive-into-com
2024-04-18,The Verge,Understanding the physics of Latent Space Sim in Automotive.,Why Voxel AI is the future of Energy. The hidden dangers of Object Permanence in Logistics. Unity announces new Digital Twins platform.,https://www.forbes.com/innovation/article/openai-announces-new-neural-physics-platform
2025-02-06,The Verge,The shift from Generative Text to Object Permanence explained.,Top 5 reasons to invest in World Models for Logistics. The shift from Generative Text to Voxel AI explained. The hidden dangers of Physics-Informed AI in Defense.,https://www.engadget.com/tag/vr/article/the-hidden-dangers-of-neural-physics-in-industrial
2025-03-23,The Verge,Why Object Permanence is the future of Energy.,Top 5 reasons to invest in Neural Physics for Defense. The hidden dangers of Physics-Informed AI in Manufacturing. The shift from Generative Text to JEPA explained.,"https://techcrunch.com/category/augmented-reality/article/forget-llms,-spatial-agents-is-what-matters-for-in"
2025-05-16,Ars Technica,Understanding the physics of Digital Twins in Automotive.,"Forget LLMs, Object Permanence is what matters for Energy. Why Spatial Agents is the future of Logistics. Understanding the physics of Voxel AI in Urban Planning.","https://www.theverge.com/vr-virtual-realityarticle/forget-llms,-neural-physics-is-what-matters-for-en"
2024-07-26,Ars Technica,"Forget LLMs, Physics-Informed AI is what matters for Energy.",Microsoft announces new Spatial Intelligence platform. The shift from Generative Text to Digital Twins explained. Top 5 reasons to invest in Neural Physics for Manufacturing.,https://www.zdnet.com/topic/vr-and-ar/article/how-openai-is-using-spatial-agents-to-revolutioniz
2025-09-29,Wired,Tesla announces new Neural Physics platform.,The ethics of World Models: Balancing Compute Cost and progress. How Unreal Engine is using Latent Space Sim to revolutionize Logistics. The hidden dangers of Latent Space Sim in Automotive.,https://www.engadget.com/tag/vr/article/why-voxel-ai-is-the-future-of-industrial-xr
2025-06-23,Ars Technica,How Google DeepMind is using Spatial Agents to revolutionize Automotive.,"Unreal Engine announces new Spatial Agents platform. Forget LLMs, JEPA is what matters for Robotics. Why Digital Twins is the future of Healthcare.",https://www.uploadvr.com/article/why-neural-physics-is-the-future-of-automotive
2024-08-31,Wired,"Forget LLMs, World Models is what matters for Industrial XR.","Why Object Permanence is the future of Manufacturing. Top 5 reasons to invest in JEPA for Energy. Forget LLMs, Digital Twins is what matters for Construction.",https://www.wired.com/tag/virtual-reality/article/the-shift-from-generative-text-to-spatial-agents-e
2024-08-25,VentureBeat,The hidden dangers of Object Permanence in Urban Planning.,The ethics of Spatial Intelligence: Balancing Hallucination and progress. The hidden dangers of JEPA in Healthcare. Top 5 reasons to invest in Spatial Intelligence for Manufacturing.,https://arstechnica.com/gaming/article/understanding-the-physics-of-voxel-ai-in-industria
2024-06-01,The Verge,Why Digital Twins is the future of Logistics.,"How Unreal Engine is using Latent Space Sim to revolutionize Energy. Understanding the physics of Voxel AI in Defense. Forget LLMs, Digital Twins is what matters for Construction.",https://www.engadget.com/tag/vr/article/the-hidden-dangers-of-neural-physics-in-urban-plan
2025-03-27,VentureBeat,Is Spatial Agents safe? A deep dive into Accuracy.,The hidden dangers of Voxel AI in Defense. The ethics of Latent Space Sim: Balancing Hallucination and progress. Why Latent Space Sim is the future of Healthcare.,https://www.wired.com/tag/virtual-reality/article/how-openai-is-using-world-models-to-revolutionize-
2025-01-18,TechCrunch,How Tesla is using Spatial Intelligence to revolutionize Automotive.,Understanding the physics of JEPA in Urban Planning. Top 5 reasons to invest in Voxel AI for Urban Planning. Top 5 reasons to invest in Voxel AI for Healthcare.,https://www.uploadvr.com/article/how-openai-is-using-voxel-ai-to-revolutionize-robo
2025-10-31,The Verge,Why Voxel AI is the future of Energy.,"Forget LLMs, Spatial Agents is what matters for Construction. How NVIDIA is using Voxel AI to revolutionize Automotive. The shift from Generative Text to Spatial Intelligence explained.",https://venturebeat.com/category/ar-vr/article/is-jepa-safe?-a-deep-dive-into-privacy
2025-04-11,TechCrunch,The shift from Generative Text to Spatial Agents explained.,The ethics of Latent Space Sim: Balancing User Experience and progress. How Unity is using Spatial Agents to revolutionize Defense. Top 5 reasons to invest in Spatial Intelligence for Logistics.,https://www.engadget.com/tag/vr/article/the-hidden-dangers-of-neural-physics-in-robotics
