Date,Source,Title,Content,URL
2025-07-15,TechCrunch,The shift from Generative Text to Object Permanence explained.,Is Spatial Intelligence safe? A deep dive into Safety. Is Latent Space Sim safe? A deep dive into Accuracy. Top 5 reasons to invest in Digital Twins for Robotics.,https://techcrunch.com/category/augmented-reality/article/nvidia-announces-new-jepa-platform
2025-11-30,The Verge,Understanding the physics of Digital Twins in Defense.,Why Spatial Intelligence is the future of Robotics. The ethics of Voxel AI: Balancing Compute Cost and progress. The hidden dangers of Physics-Informed AI in Robotics.,https://www.engadget.com/tag/vr/article/top-5-reasons-to-invest-in-latent-space-sim-for-co
2025-06-19,The Verge,The hidden dangers of Voxel AI in Energy.,"Forget LLMs, World Models is what matters for Urban Planning. Top 5 reasons to invest in Object Permanence for Robotics. Why Neural Physics is the future of Manufacturing.",https://techcrunch.com/category/augmented-reality/article/how-microsoft-is-using-spatial-intelligence-to-rev
2024-01-13,Wired,Why Voxel AI is the future of Industrial XR.,Is Voxel AI safe? A deep dive into Safety. NVIDIA announces new Spatial Intelligence platform. Top 5 reasons to invest in Latent Space Sim for Energy.,https://www.roadtovr.com/article/the-shift-from-generative-text-to-spatial-agents-e
2025-06-13,The Verge,How Google DeepMind is using Spatial Intelligence to revolutionize Defense.,Why Spatial Agents is the future of Defense. Siemens announces new Latent Space Sim platform. The hidden dangers of Voxel AI in Industrial XR.,"https://www.roadtovr.com/article/forget-llms,-jepa-is-what-matters-for-logistics"
2025-11-24,VentureBeat,Is Spatial Intelligence safe? A deep dive into Privacy.,"Forget LLMs, Latent Space Sim is what matters for Automotive. Why Neural Physics is the future of Manufacturing. Is Digital Twins safe? A deep dive into Accuracy.",https://www.roadtovr.com/article/the-hidden-dangers-of-latent-space-sim-in-manufact
2025-05-08,The Verge,NVIDIA announces new JEPA platform.,"Top 5 reasons to invest in Voxel AI for Logistics. The shift from Generative Text to Spatial Intelligence explained. Forget LLMs, Object Permanence is what matters for Automotive.",https://arstechnica.com/gaming/article/the-hidden-dangers-of-digital-twins-in-energy
2024-03-09,VentureBeat,Unity announces new Physics-Informed AI platform.,Is JEPA safe? A deep dive into Ethics. Understanding the physics of Neural Physics in Construction. The hidden dangers of Neural Physics in Robotics.,https://techcrunch.com/category/augmented-reality/article/the-hidden-dangers-of-jepa-in-urban-planning
2025-01-17,TechCrunch,How Siemens is using Spatial Intelligence to revolutionize Manufacturing.,Top 5 reasons to invest in Object Permanence for Healthcare. How Unity is using Physics-Informed AI to revolutionize Industrial XR. The ethics of Voxel AI: Balancing Data Security and progress.,https://www.forbes.com/innovation/article/top-5-reasons-to-invest-in-world-models-for-manufa
2025-02-26,Ars Technica,Siemens announces new Digital Twins platform.,Top 5 reasons to invest in Voxel AI for Robotics. Why Digital Twins is the future of Defense. Siemens announces new World Models platform.,https://www.zdnet.com/topic/vr-and-ar/article/top-5-reasons-to-invest-in-digital-twins-for-const
2025-11-12,VentureBeat,"Forget LLMs, World Models is what matters for Defense.",How Google DeepMind is using Object Permanence to revolutionize Urban Planning. The shift from Generative Text to JEPA explained. Understanding the physics of Digital Twins in Energy.,https://www.engadget.com/tag/vr/article/why-latent-space-sim-is-the-future-of-automotive
2025-09-16,TechCrunch,Why Physics-Informed AI is the future of Automotive.,Understanding the physics of Physics-Informed AI in Logistics. How Apple is using World Models to revolutionize Defense. The ethics of Neural Physics: Balancing Latency and progress.,https://www.forbes.com/innovation/article/top-5-reasons-to-invest-in-neural-physics-for-robo
2024-01-12,Wired,How Tesla is using Physics-Informed AI to revolutionize Healthcare.,"Forget LLMs, Voxel AI is what matters for Urban Planning. The ethics of Latent Space Sim: Balancing Ethics and progress. Top 5 reasons to invest in Spatial Intelligence for Logistics.",https://www.engadget.com/tag/vr/article/why-digital-twins-is-the-future-of-logistics
2024-02-01,Ars Technica,Top 5 reasons to invest in Digital Twins for Healthcare.,How Meta is using Digital Twins to revolutionize Manufacturing. Why JEPA is the future of Energy. Is Object Permanence safe? A deep dive into Surveillance.,https://www.uploadvr.com/article/the-shift-from-generative-text-to-neural-physics-e
2025-11-24,Wired,The shift from Generative Text to Neural Physics explained.,Top 5 reasons to invest in Spatial Agents for Automotive. How NVIDIA is using Object Permanence to revolutionize Manufacturing. NVIDIA announces new Neural Physics platform.,https://www.zdnet.com/topic/vr-and-ar/article/top-5-reasons-to-invest-in-neural-physics-for-auto
2024-05-23,TechCrunch,Top 5 reasons to invest in Voxel AI for Healthcare.,The hidden dangers of Digital Twins in Defense. The ethics of Object Permanence: Balancing Safety and progress. Is Neural Physics safe? A deep dive into Ethics.,https://www.zdnet.com/topic/vr-and-ar/article/top-5-reasons-to-invest-in-jepa-for-defense
2024-05-18,VentureBeat,The ethics of Latent Space Sim: Balancing Ethics and progress.,"Forget LLMs, Object Permanence is what matters for Industrial XR. Is Physics-Informed AI safe? A deep dive into Ethics. The ethics of JEPA: Balancing Data Security and progress.",https://www.zdnet.com/topic/vr-and-ar/article/is-digital-twins-safe?-a-deep-dive-into-surveillan
2025-11-29,The Verge,How Tesla is using Object Permanence to revolutionize Robotics.,Understanding the physics of Spatial Agents in Manufacturing. The hidden dangers of Spatial Agents in Logistics. Is Digital Twins safe? A deep dive into Hallucination.,https://www.uploadvr.com/article/how-google-deepmind-is-using-neural-physics-to-rev
2024-08-11,VentureBeat,Understanding the physics of Object Permanence in Manufacturing.,"Top 5 reasons to invest in Physics-Informed AI for Manufacturing. Forget LLMs, Neural Physics is what matters for Construction. Top 5 reasons to invest in Neural Physics for Manufacturing.",https://venturebeat.com/category/ar-vr/article/why-physics-informed-ai-is-the-future-of-urban-pla
2024-01-27,Ars Technica,Top 5 reasons to invest in Digital Twins for Industrial XR.,Why Voxel AI is the future of Manufacturing. The hidden dangers of Neural Physics in Defense. The hidden dangers of Physics-Informed AI in Logistics.,"https://www.theverge.com/vr-virtual-realityarticle/forget-llms,-world-models-is-what-matters-for-indu"
2025-09-26,The Verge,Why Physics-Informed AI is the future of Manufacturing.,The shift from Generative Text to Digital Twins explained. How Siemens is using JEPA to revolutionize Defense. Is Voxel AI safe? A deep dive into Data Security.,https://www.engadget.com/tag/vr/article/why-physics-informed-ai-is-the-future-of-logistics
2025-10-31,Wired,Is Spatial Agents safe? A deep dive into Latency.,The hidden dangers of Digital Twins in Defense. Is Object Permanence safe? A deep dive into Data Security. The shift from Generative Text to Spatial Agents explained.,https://venturebeat.com/category/ar-vr/article/the-ethics-of-object-permanence-balancing-accuracy
2025-11-27,Ars Technica,Understanding the physics of Latent Space Sim in Manufacturing.,Is Voxel AI safe? A deep dive into User Experience. Top 5 reasons to invest in Neural Physics for Construction. Google DeepMind announces new Digital Twins platform.,"https://www.theverge.com/vr-virtual-realityarticle/forget-llms,-latent-space-sim-is-what-matters-for-"
2025-08-10,VentureBeat,Why Digital Twins is the future of Automotive.,"Forget LLMs, Object Permanence is what matters for Urban Planning. Apple announces new Digital Twins platform. The ethics of JEPA: Balancing Safety and progress.",https://arstechnica.com/gaming/article/is-latent-space-sim-safe?-a-deep-dive-into-ethics
2025-12-13,The Verge,Why Object Permanence is the future of Industrial XR.,Understanding the physics of Physics-Informed AI in Manufacturing. Top 5 reasons to invest in World Models for Healthcare. Understanding the physics of Latent Space Sim in Healthcare.,https://www.forbes.com/innovation/article/the-shift-from-generative-text-to-latent-space-sim
2025-07-07,TechCrunch,Is Digital Twins safe? A deep dive into Surveillance.,The shift from Generative Text to JEPA explained. Top 5 reasons to invest in Digital Twins for Urban Planning. Why Spatial Intelligence is the future of Urban Planning.,https://arstechnica.com/gaming/article/top-5-reasons-to-invest-in-neural-physics-for-ener
2024-09-29,VentureBeat,Is Physics-Informed AI safe? A deep dive into Privacy.,The hidden dangers of Spatial Agents in Automotive. The shift from Generative Text to Spatial Agents explained. OpenAI announces new Digital Twins platform.,https://arstechnica.com/gaming/article/google-deepmind-announces-new-world-models-platfor
2025-02-14,TechCrunch,Top 5 reasons to invest in Latent Space Sim for Logistics.,Is Object Permanence safe? A deep dive into Safety. The ethics of Latent Space Sim: Balancing Latency and progress. Why Neural Physics is the future of Industrial XR.,"https://www.zdnet.com/topic/vr-and-ar/article/forget-llms,-world-models-is-what-matters-for-heal"
2024-07-26,TechCrunch,Unreal Engine announces new Spatial Agents platform.,Microsoft announces new Latent Space Sim platform. Top 5 reasons to invest in World Models for Automotive. Top 5 reasons to invest in Physics-Informed AI for Urban Planning.,https://www.theverge.com/vr-virtual-realityarticle/why-spatial-agents-is-the-future-of-construction
2025-01-19,VentureBeat,OpenAI announces new World Models platform.,Is Neural Physics safe? A deep dive into Hallucination. Why Physics-Informed AI is the future of Automotive. Is Latent Space Sim safe? A deep dive into Data Security.,https://www.wired.com/tag/virtual-reality/article/meta-announces-new-spatial-intelligence-platform
2024-03-08,Ars Technica,Understanding the physics of Spatial Intelligence in Construction.,"Forget LLMs, Neural Physics is what matters for Automotive. How Siemens is using Spatial Intelligence to revolutionize Manufacturing. How OpenAI is using JEPA to revolutionize Energy.",https://www.wired.com/tag/virtual-reality/article/the-ethics-of-world-models-balancing-accuracy-and-
2024-01-16,Ars Technica,Understanding the physics of Neural Physics in Automotive.,"Forget LLMs, Spatial Agents is what matters for Energy. Top 5 reasons to invest in JEPA for Urban Planning. The hidden dangers of Spatial Intelligence in Energy.",https://venturebeat.com/category/ar-vr/article/the-shift-from-generative-text-to-object-permanenc
2025-11-10,VentureBeat,The ethics of Spatial Intelligence: Balancing Latency and progress.,"Microsoft announces new World Models platform. Forget LLMs, Physics-Informed AI is what matters for Construction. The ethics of Digital Twins: Balancing Data Security and progress.",https://www.engadget.com/tag/vr/article/why-voxel-ai-is-the-future-of-automotive
2024-11-02,TechCrunch,Understanding the physics of Digital Twins in Manufacturing.,"Understanding the physics of Digital Twins in Defense. Apple announces new Spatial Agents platform. Forget LLMs, Latent Space Sim is what matters for Healthcare.",https://www.wired.com/tag/virtual-reality/article/top-5-reasons-to-invest-in-digital-twins-for-urban
2024-04-08,TechCrunch,The ethics of Neural Physics: Balancing Safety and progress.,Is Object Permanence safe? A deep dive into Ethics. How Apple is using JEPA to revolutionize Manufacturing. NVIDIA announces new Spatial Agents platform.,https://www.engadget.com/tag/vr/article/why-latent-space-sim-is-the-future-of-manufacturin
2025-06-19,Ars Technica,The ethics of Spatial Agents: Balancing Data Security and progress.,Top 5 reasons to invest in Physics-Informed AI for Construction. The ethics of Latent Space Sim: Balancing Latency and progress. The shift from Generative Text to Latent Space Sim explained.,https://www.uploadvr.com/article/the-hidden-dangers-of-object-permanence-in-healthc
2024-05-04,The Verge,Why Latent Space Sim is the future of Defense.,How Siemens is using Object Permanence to revolutionize Industrial XR. Understanding the physics of Spatial Agents in Defense. The shift from Generative Text to World Models explained.,https://www.engadget.com/tag/vr/article/the-ethics-of-voxel-ai-balancing-latency-and-progr
2024-11-13,TechCrunch,The hidden dangers of World Models in Healthcare.,Understanding the physics of Neural Physics in Manufacturing. OpenAI announces new Neural Physics platform. How Unreal Engine is using Digital Twins to revolutionize Manufacturing.,https://www.engadget.com/tag/vr/article/the-shift-from-generative-text-to-spatial-intellig
2024-12-23,Wired,Siemens announces new Digital Twins platform.,"The ethics of Object Permanence: Balancing Ethics and progress. Forget LLMs, Spatial Agents is what matters for Healthcare. Understanding the physics of Latent Space Sim in Industrial XR.",https://www.wired.com/tag/virtual-reality/article/the-hidden-dangers-of-world-models-in-healthcare
2024-12-16,Wired,Top 5 reasons to invest in Digital Twins for Urban Planning.,Understanding the physics of Physics-Informed AI in Industrial XR. Understanding the physics of Latent Space Sim in Construction. Top 5 reasons to invest in Physics-Informed AI for Industrial XR.,https://arstechnica.com/gaming/article/how-tesla-is-using-latent-space-sim-to-revolutioni
2025-10-25,Wired,"Forget LLMs, Digital Twins is what matters for Defense.",The shift from Generative Text to World Models explained. Top 5 reasons to invest in JEPA for Construction. Is Neural Physics safe? A deep dive into Data Security.,"https://www.forbes.com/innovation/article/forget-llms,-neural-physics-is-what-matters-for-ur"
2025-10-23,The Verge,The shift from Generative Text to World Models explained.,"Forget LLMs, JEPA is what matters for Urban Planning. The shift from Generative Text to Spatial Intelligence explained. Is Physics-Informed AI safe? A deep dive into Accuracy.","https://venturebeat.com/category/ar-vr/article/forget-llms,-digital-twins-is-what-matters-for-urb"
2024-01-03,Wired,The ethics of Physics-Informed AI: Balancing Hallucination and progress.,Why World Models is the future of Logistics. The ethics of Digital Twins: Balancing Safety and progress. The ethics of Neural Physics: Balancing Safety and progress.,"https://www.wired.com/tag/virtual-reality/article/forget-llms,-digital-twins-is-what-matters-for-log"
2025-05-28,VentureBeat,"Forget LLMs, Physics-Informed AI is what matters for Defense.",Top 5 reasons to invest in Digital Twins for Defense. Google DeepMind announces new Latent Space Sim platform. The hidden dangers of Digital Twins in Healthcare.,"https://www.roadtovr.com/article/forget-llms,-neural-physics-is-what-matters-for-he"
2024-09-07,Ars Technica,The ethics of JEPA: Balancing Safety and progress.,"The hidden dangers of Object Permanence in Energy. Meta announces new Object Permanence platform. Forget LLMs, Neural Physics is what matters for Energy.",https://venturebeat.com/category/ar-vr/article/understanding-the-physics-of-neural-physics-in-man
2024-03-09,Ars Technica,Meta announces new Digital Twins platform.,"Top 5 reasons to invest in Latent Space Sim for Automotive. The shift from Generative Text to JEPA explained. Forget LLMs, World Models is what matters for Construction.",https://www.theverge.com/vr-virtual-realityarticle/how-microsoft-is-using-digital-twins-to-revolution
2025-04-29,TechCrunch,Why Latent Space Sim is the future of Urban Planning.,How Microsoft is using World Models to revolutionize Industrial XR. Is Object Permanence safe? A deep dive into Accuracy. The hidden dangers of Spatial Agents in Robotics.,https://www.zdnet.com/topic/vr-and-ar/article/why-world-models-is-the-future-of-healthcare
2025-09-08,VentureBeat,The shift from Generative Text to Object Permanence explained.,"The ethics of Latent Space Sim: Balancing Ethics and progress. Forget LLMs, JEPA is what matters for Construction. Is Neural Physics safe? A deep dive into Data Security.",https://techcrunch.com/category/augmented-reality/article/the-ethics-of-world-models-balancing-hallucination
2025-07-02,Wired,The shift from Generative Text to Object Permanence explained.,How Siemens is using JEPA to revolutionize Robotics. The ethics of Latent Space Sim: Balancing Safety and progress. The hidden dangers of Digital Twins in Manufacturing.,https://www.roadtovr.com/article/how-unity-is-using-neural-physics-to-revolutionize
2025-11-29,TechCrunch,Top 5 reasons to invest in Neural Physics for Healthcare.,"How NVIDIA is using World Models to revolutionize Energy. Forget LLMs, Neural Physics is what matters for Construction. Forget LLMs, World Models is what matters for Logistics.",https://www.uploadvr.com/article/understanding-the-physics-of-physics-informed-ai-i
2025-08-14,Ars Technica,Is Latent Space Sim safe? A deep dive into User Experience.,"OpenAI announces new Object Permanence platform. How Siemens is using Neural Physics to revolutionize Robotics. Forget LLMs, Physics-Informed AI is what matters for Healthcare.",https://www.roadtovr.com/article/the-ethics-of-jepa-balancing-surveillance-and-prog
2025-02-21,VentureBeat,How Apple is using Physics-Informed AI to revolutionize Defense.,The shift from Generative Text to Physics-Informed AI explained. The ethics of Object Permanence: Balancing User Experience and progress. Understanding the physics of Spatial Intelligence in Healthcare.,https://www.engadget.com/tag/vr/article/how-tesla-is-using-voxel-ai-to-revolutionize-healt
2024-08-26,The Verge,The shift from Generative Text to Voxel AI explained.,Understanding the physics of Voxel AI in Industrial XR. How Unreal Engine is using Latent Space Sim to revolutionize Energy. How Unreal Engine is using Latent Space Sim to revolutionize Robotics.,https://techcrunch.com/category/augmented-reality/article/top-5-reasons-to-invest-in-spatial-intelligence-fo
2025-09-26,VentureBeat,OpenAI announces new JEPA platform.,How Tesla is using Physics-Informed AI to revolutionize Urban Planning. The hidden dangers of Object Permanence in Urban Planning. Understanding the physics of Neural Physics in Healthcare.,https://www.roadtovr.com/article/is-object-permanence-safe?-a-deep-dive-into-privac
2024-05-01,Wired,How Microsoft is using Spatial Intelligence to revolutionize Construction.,Why Voxel AI is the future of Urban Planning. The hidden dangers of Physics-Informed AI in Urban Planning. The ethics of Physics-Informed AI: Balancing Latency and progress.,https://www.zdnet.com/topic/vr-and-ar/article/apple-announces-new-latent-space-sim-platform
2025-01-15,Ars Technica,Top 5 reasons to invest in Physics-Informed AI for Robotics.,"Forget LLMs, Latent Space Sim is what matters for Logistics. How Siemens is using Spatial Agents to revolutionize Construction. The shift from Generative Text to Neural Physics explained.",https://www.zdnet.com/topic/vr-and-ar/article/the-shift-from-generative-text-to-voxel-ai-explain
2025-07-30,VentureBeat,"Forget LLMs, World Models is what matters for Urban Planning.",Tesla announces new JEPA platform. Unity announces new Voxel AI platform. Understanding the physics of Object Permanence in Construction.,https://www.zdnet.com/topic/vr-and-ar/article/top-5-reasons-to-invest-in-voxel-ai-for-defense
2025-04-07,TechCrunch,Understanding the physics of Spatial Agents in Automotive.,The shift from Generative Text to Neural Physics explained. Understanding the physics of Spatial Agents in Logistics. Is Neural Physics safe? A deep dive into Accuracy.,https://www.forbes.com/innovation/article/the-hidden-dangers-of-jepa-in-manufacturing
2025-08-26,Wired,The ethics of Digital Twins: Balancing Safety and progress.,How Microsoft is using Digital Twins to revolutionize Construction. Is World Models safe? A deep dive into Compute Cost. How Google DeepMind is using World Models to revolutionize Industrial XR.,https://www.forbes.com/innovation/article/the-shift-from-generative-text-to-world-models-exp
2024-05-10,TechCrunch,The ethics of Neural Physics: Balancing Compute Cost and progress.,The shift from Generative Text to Digital Twins explained. The hidden dangers of Physics-Informed AI in Energy. Understanding the physics of Digital Twins in Healthcare.,https://arstechnica.com/gaming/article/tesla-announces-new-world-models-platform
2025-10-10,Ars Technica,Microsoft announces new Neural Physics platform.,The hidden dangers of Latent Space Sim in Healthcare. The shift from Generative Text to Neural Physics explained. The ethics of Object Permanence: Balancing Compute Cost and progress.,https://www.zdnet.com/topic/vr-and-ar/article/the-ethics-of-object-permanence-balancing-hallucin
2024-01-14,Wired,Top 5 reasons to invest in Voxel AI for Robotics.,How Tesla is using JEPA to revolutionize Healthcare. The ethics of Spatial Agents: Balancing Latency and progress. Top 5 reasons to invest in Latent Space Sim for Automotive.,https://arstechnica.com/gaming/article/the-ethics-of-world-models-balancing-data-security
2024-04-09,VentureBeat,Top 5 reasons to invest in World Models for Robotics.,"The ethics of Digital Twins: Balancing Ethics and progress. Forget LLMs, Physics-Informed AI is what matters for Logistics. Siemens announces new Physics-Informed AI platform.",https://www.uploadvr.com/article/the-ethics-of-spatial-agents-balancing-data-securi
2024-01-17,VentureBeat,The ethics of Latent Space Sim: Balancing User Experience and progress.,"Forget LLMs, Object Permanence is what matters for Robotics. Understanding the physics of Neural Physics in Logistics. The hidden dangers of Object Permanence in Healthcare.",https://venturebeat.com/category/ar-vr/article/tesla-announces-new-world-models-platform
2024-03-13,Wired,The hidden dangers of Neural Physics in Robotics.,Is Physics-Informed AI safe? A deep dive into Hallucination. How Unity is using Latent Space Sim to revolutionize Energy. Top 5 reasons to invest in Physics-Informed AI for Industrial XR.,https://www.forbes.com/innovation/article/top-5-reasons-to-invest-in-jepa-for-industrial-xr
2024-07-02,Ars Technica,Is Voxel AI safe? A deep dive into Latency.,How Unity is using Digital Twins to revolutionize Defense. The shift from Generative Text to Spatial Intelligence explained. Why Physics-Informed AI is the future of Industrial XR.,https://www.wired.com/tag/virtual-reality/article/understanding-the-physics-of-spatial-intelligence-
2025-09-24,Ars Technica,The hidden dangers of JEPA in Defense.,The ethics of World Models: Balancing Latency and progress. The ethics of Object Permanence: Balancing Compute Cost and progress. Is Voxel AI safe? A deep dive into Data Security.,https://www.theverge.com/vr-virtual-realityarticle/why-voxel-ai-is-the-future-of-logistics
2025-03-27,Wired,Top 5 reasons to invest in Physics-Informed AI for Urban Planning.,"Why Latent Space Sim is the future of Energy. Forget LLMs, Voxel AI is what matters for Energy. Why Object Permanence is the future of Energy.",https://www.engadget.com/tag/vr/article/the-shift-from-generative-text-to-voxel-ai-explain
2025-10-18,The Verge,How Unity is using Physics-Informed AI to revolutionize Urban Planning.,"Top 5 reasons to invest in Spatial Intelligence for Manufacturing. Forget LLMs, Neural Physics is what matters for Construction. The shift from Generative Text to Voxel AI explained.",https://techcrunch.com/category/augmented-reality/article/is-neural-physics-safe?-a-deep-dive-into-safety
2025-01-16,The Verge,Top 5 reasons to invest in Digital Twins for Industrial XR.,The shift from Generative Text to Spatial Agents explained. Is Physics-Informed AI safe? A deep dive into Compute Cost. Top 5 reasons to invest in World Models for Urban Planning.,https://www.wired.com/tag/virtual-reality/article/the-ethics-of-physics-informed-ai-balancing-survei
2025-09-25,TechCrunch,"Forget LLMs, Object Permanence is what matters for Defense.",The shift from Generative Text to JEPA explained. Unreal Engine announces new JEPA platform. Understanding the physics of Voxel AI in Construction.,https://www.roadtovr.com/article/is-physics-informed-ai-safe?-a-deep-dive-into-surv
2024-02-03,Wired,The shift from Generative Text to Neural Physics explained.,The hidden dangers of Digital Twins in Defense. The hidden dangers of Spatial Agents in Healthcare. The shift from Generative Text to Spatial Intelligence explained.,"https://arstechnica.com/gaming/article/forget-llms,-object-permanence-is-what-matters-for"
2024-04-06,TechCrunch,"Forget LLMs, Physics-Informed AI is what matters for Automotive.",Meta announces new Physics-Informed AI platform. Top 5 reasons to invest in Spatial Agents for Automotive. The shift from Generative Text to Physics-Informed AI explained.,https://www.zdnet.com/topic/vr-and-ar/article/the-hidden-dangers-of-jepa-in-energy
2025-10-09,The Verge,Top 5 reasons to invest in Neural Physics for Robotics.,"Forget LLMs, Spatial Agents is what matters for Construction. Top 5 reasons to invest in Spatial Intelligence for Energy. How Microsoft is using Spatial Intelligence to revolutionize Robotics.",https://www.uploadvr.com/article/how-tesla-is-using-voxel-ai-to-revolutionize-urban
2024-09-04,TechCrunch,Top 5 reasons to invest in Neural Physics for Automotive.,The ethics of Object Permanence: Balancing Data Security and progress. The ethics of World Models: Balancing Ethics and progress. Understanding the physics of World Models in Defense.,https://www.uploadvr.com/article/the-hidden-dangers-of-latent-space-sim-in-logistic
