Timestamp,Handle,Tweet,Hashtags,Tweet_URL
2024-02-03,@ow,Vision Pro is genuinely incredible technology. But the killer app isn't here yet. Give developers time.,#VisionPro #SpatialComputing,https://twitter.com/ow/status/1753892341234567890
2024-04-18,@ylecun,World models are the path to machines that understand causality and physics. LLMs are just pattern matchers.,#AI #WorldModels,https://twitter.com/ylecun/status/1780234567891234567
2024-09-25,@nvidiaai,New NVIDIA Omniverse updates enable real-time collaboration on industrial digital twins at unprecedented scale.,#Omniverse #DigitalTwins,https://twitter.com/nvidiaai/status/1838456789123456789
2024-06-11,@MetaRealityLabs,Quest 3 brings high-quality mixed reality to the masses at $499. This is the inflection point.,#Quest3 #MixedReality,https://twitter.com/MetaRealityLabs/status/1800123456789123456
2024-11-04,@karpathy,Spatial AI is underrated. The physical world has structure that text doesn't capture.,#SpatialAI #AI,https://twitter.com/karpathy/status/1853789123456789123
2024-03-07,@benedictevans,XR has been 'almost there' for a decade. Vision Pro is technically amazing but doesn't change that.,#VisionPro #XR,https://twitter.com/benedictevans/status/1765456789123456789
2024-07-29,@sama,Multimodal AI that understands 3D space will be more impactful than pure language models.,#AI #SpatialIntelligence,https://twitter.com/sama/status/1817890123456789123
2024-01-15,@scobleizer,"After trying Vision Pro, I'm convinced spatial computing is the next platform. Just give it 3-5 years.",#VisionPro #SpatialComputing,https://twitter.com/scobleizer/status/1746123456789123456
2024-10-12,@ballmatthew,"Industrial metaverse applications (digital twins, training) have clear ROI. Consumer metaverse still searching for PMF.",#Metaverse #DigitalTwins,https://twitter.com/ballmatthew/status/1845234567891234567
2024-05-22,@emollick,AI + XR for training is incredibly effective. Saw a surgical training demo that was transformative.,#AI #XR #MedTech,https://twitter.com/emollick/status/1793345678912345678
2024-08-19,@ID_AA_Carmack,"Still lots of engineering challenges in XR. Optics, ergonomics, battery life - all need another generation of work.",#VR #Engineering,https://twitter.com/ID_AA_Carmack/status/1825567891234567891
2024-12-06,@hardmaru,World models that can simulate physics enable entirely new approaches to robotics and embodied AI.,#WorldModels #Robotics,https://twitter.com/hardmaru/status/1864678912345678912
2023-11-15,@boztank,"Privacy in always-on spatial computing devices needs to be designed in from day one, not bolted on later.",#Privacy #SpatialComputing,https://twitter.com/boztank/status/1724789123456789123
2024-04-09,@unity,"We hear your feedback. Unity is committed to transparent, developer-friendly pricing. Changes coming soon.",#Unity #GameDev,https://twitter.com/unity/status/1777890234567891234
2024-09-03,@UnrealEngine,Unreal Engine 5.4 brings major improvements to VR performance and mixed reality development workflows.,#UE5 #VR #MixedReality,https://twitter.com/UnrealEngine/status/1830901234567891234
